name,title,url_comments,comments,selftext
t3_ktjva7,ATTENTION  If you are here from the left or the right. DO NOT ADVOCATE VIOLENCE or for anyone to be killed. DO NOT advocate civil war or ALLUDE TO IT. This means ALL OF YOU. Left or right  we will ban you...and reddit will action your account.,https://www.reddit.com/r/conservatives/comments/ktjva7/attention_if_you_are_here_from_the_left_or_the/," r topmindsofreddit has linked to this submission.

We removed some abusive comments  but since the person making them linked this sub to topmindsofreddit  we are re approving the comments so that users can see how reddit be.

Reddit is a place where you go to a sub and abuse people   as an eight day old account claiming to have just  accidentally  found the submission  then link to another meta sub  that your eight day old account just ALSO  happened to come across    to talk about the responses you got to your comment and then after posting there you come back again to keep commenting... then others from the subreddit that you posted in come here to comment unapologetically saying you  deserve it .

Actually  this is pretty much the shit sundae of trying to be conservatives on reddit.

Make a post condemning violence and telling EVERYONE no matter what not to do it... get the post brigaded by another subreddit.

Funzies  Off the topic  but I m going to say it   Roombas with teeth  is one of the best things I ve read on here in a while Thank you for this  I ve noticed this too. Most of the new  conservatives  who defend the capitol riot are not actually conservatives  they re trying to get this subreddit banned  I saw people commenting in r politics about trying to do this .

Automatically ban anyone who promotes violence because chances are  the true conservatives in this group have nothing to do with the people who are advocating for the violence in the group. I freaking hate you right now. I m going to dream of roombas with teeth tonight and when I wake my kids screaming I hope somewhere out there you shiver and know you ll have my eternal enemity. Hi  I m pretty ducking liberal  but this sub doesn t seem to be a safe space like the other one  and I appreciate that .I ll try to not spam you with my filthy liberal ideas  and am mostly here to remember all the things most Americans Agree upon    just see different roads to get there Understood. Part of this overt attempt to censor is to outrage and continue to divide. It s clear we cannot divide despite considering this censorship to be incredibly dangerous. 

There will be peace and harmony as most Americans are good people. We will continue to prosper. IBiteYou 2024. Thank you for this. Thank you for this statement. Don t worry  I don t have to say I want a civil war for this subreddit to be banned  they ve already banned a few conservatives republicans subreddits  they re banning millions of conservative Twitter and FB accounts  hell even Parler is getting banned. Simple saying telling the rioters to go home and for ppl to stay peaceful was apparently enough reason to delete that tweet and ban Trump s account. It s only a matter of time b4 they ban all accounts that even suggest we want peace and hope You don t even have to say that. Admins are threatening me for this post 

https   www.reddit.com r conservatives comments ksohfs blmba wishes more women were shot and killed 

I did not support violence in that post in any way. Nor can I argue the point with them in a reply.

They are just making up whatever they want to. Could everyone  instead of calling for fucking violence  just let us all try to be AMERICANS AGAIN  Try MOVING ON  

I m sick of all of you. Left  right  center  I m done. It s an embarrassment being on this land with you bastards.

Edit for clarity before people make assumptions  I popped in on r popular sorted by Rising. I just came across it. I am not a conservative  a liberal  a progressive  an authoritarian  nothing. I am one of many trying to get by while every side of the country implodes and ruins everyone s lives. What do we do if we have a tyrannical government that completely overlooks our constitution  and takes away human rights from its citizens  slowly  but surely  We let it happen   D Saying that the protesters should face justice is not inciting violence imo.  The guys who brought the bombs should face high punishemnents.

However I don t believe that the police should have killed everyone at the protest. Hi  if you want parler for Android click on this  Https   company.parler.com android parler release.apk fuck google and their censoring.  Do not come here and say   All you fucking conservatives need to hang for sedition. 

Do not say   Bullets need to rain down on you Republican traitors .

I SO MUCH agree with this. But also don t come here and say  

Do not come here and say   All fucking democrats need to hang. 

Do not say   Bullets need to rain down on you Democrat traitors .

Can t we all just live in peace like it was before fuckin  social media and internet feel good bubbles  How did people engage in political intercourse before the bloody internet  This shouldn t have to be said. Bite me pls uwu I m already banned. Don t say reddit is run by left wing nut cases Except liberals can say this in politics and it s all fine and good.  roombas with TEETH 

Well  that s a very unique way of putting it... Can t we all just get along All those flaired accounts posting in  flaired users only  threads are a false flag attack  Come on  man...

r Thisisntwhoweare","I mean it... Goddamn it.

Do not come here and say   All you fucking conservatives need to hang for sedition. 

Do not say   Bullets need to rain down on you Republican traitors .

Do not come here and say   It s time for civil war. 

This is OUR subreddit and we WILL do our best to ensure that reddit doesn t have a valid reason to shut it down.

Some of you  righties  coming to talk about wanting civil war or insurrection are people we have NEVER SEEN BEFORE.

And you started this JUST as the events in DC happened.

We know what false flags are. If you say things here that will get our subreddit actioned by the admins  we ll ban you AND REPORT YOU TO THEM.

We have NEVER had a problem with this here before and it will not start now.

Our mods are active...like roombas with TEETH... and we will PUT a quick stop to any advocacy of violence here."
t3_kv5nyw,Exactly Where and How Did Trump Incite the Mob ,https://www.reddit.com/r/conservatives/comments/kv5nyw/exactly_where_and_how_did_trump_incite_the_mob/," gt  The Dodgy Timeline.

 gt  And while the Washington Post clumsily attempts to blame President Trump for the violence   despite the President calling for  peaceful  protests and the  cheering on  of Congressmen   their own article admits the  first wave of protesters arrived at the Capitol about 12 40pm. 

 gt  President Trump s speech didn t conclude until 1 11pm  and with at least a 45 minute walk between the two locations with crowd related delays  that would put the first people from Trump s speech at Capitol Hill no earlier than 1 56pm   a full hour and sixteen minutes after troublemakers arrived.

 gt  In fact  rioters who breached the perimeter would have had to leave before Trump s speech even began  at 12pm precisely  to make it in time for the events as they are detailed by authorities.

 gt  The Washington Post also states   Sund s outer perimeter on the Capitol s west side was breached within 15 minutes   meaning the Capitol was breached over an hour before Trump speech attendees could have even begun to arrive.

 gt  This correlates with Sund s interview  where he admits   I realized at 1pm  things aren t going well  I m watching my people getting slammed. 

 gt  Again  1pm would have been a full 56 minutes before any Trump speech attendees could have begun arriving  let alone breaching the perimeter and clashing with police. Downtown Washington  D.C. roads were closed. There was no way of arriving faster  let alone before the President had finished speaking.

 gt  At 1 09pm  still before the President had finished speaking  Sund called the Sergeants at arms of the House and Senate. He told them it was time to call in the National Guard. He even said he wanted an emergency declaration. Both  however  said they would  run it up the chain  and get back to him.

 gt  At 1 50pm the Capitol itself was breached. Still before most Trump speech attendees could have arrived.

 gt  What happened after this point was a back and forth over hours between D.C. officials  Army officials  and Capitol police.

 gt  Eventually   at past 5pm   the National Guard arrived.

 gt  And while Sund is quoted in the Washington Post as blaming President Trump s speech for the violence that ensued   the timeline means that makes no sense.

 gt  The President s fans are not known for leaving his speeches 5 or 10 minutes in. And by the time the Capitol was breached  those who had stayed to listen to even the first 15 minutes would not have even made it there in time. Twitter wrote a rambling explanation trying to make the case that  I will not be attending the inauguration  is a call for violence. Sounded even crazier than anything Alex Jones has ever said.

https   blog.twitter.com en us topics company 2020 suspension.html For years now the fascists on the left have been looking very hard to make Republicans their targeted class. I say  targeted class  because that just tends to be the case with those sort of regimes  to make sure there is some identified class of people they can identify as causing all of their ills and then grab power in part by way of attacking this class.

Attacking Republicans in general never really worked. A lot of  racists   and  nazis   and  sexists    but it never really stuck so well because of moderates who swung both ways as well as the attacks never really making much sense in the first place.  You re racist because you don t support dividing people by race  doesn t really jive with common sense.

After so long  and especially after these four years  they finally have their moment and their specific target. It doesn t really stick when you actually look into it  but this is the best chance they ve had in so long that they re going to go with it one way or another. And the timing is certainly right  with basically every means of communication being controlled by left that any sort of  The left is being stupid  argument is just never going to be heard by the masses. Is the average person going to hear from the Right on reddit  Nope  that s basically all been banned and moderated away. Fox News  Oh  they re already saying Fox News should be banned. Twitter  Obviously not. Youtube  Those voices have already been demonetized. General internet  Not with Google in charge. And as fascists will do  once they silence the biggest voice  they ll go after the next biggest after that. 

And as I said  they also have their specific target  Trump supporters. It s a very specific and targeted group. This sub is filled with page after page of examples of Trump supports already having been punished for the crime of being a Trump supporter.

The other day a U.S. Representative called on all Republicans to be removed from office. AOC and others have called on social media to keep a list of their users who have supported Trump. 

It doesn t matter much just what Trump did or didn t say. It also doesn t matter that the left has been complete hypocrites for their words and actions now compared to the BLM riots. Obviously  nobody on the left is looking to have a spirited conversation about it all. This is their best opportunity because they re already in control of everything.

I only expect further efforts over the next two years to silence Conservatives even further. And why not  Who s going to stop them  Democrat politicians have always been much much better at being unified than Republicans  so even with that even split in the Senate  I expect there will be a LOT of pressure on any moderate Democrats to stay in line. Don t recall his name  but there is one democrat senator who has always said he will not vote for Puerto Rico and D.C. statehood  nor would he vote to pack the Court. And just yesterday he said he was reconsidering his position. Gee  you think maybe there was an important committee appointment on the line 

We re heading down a very dark path. Never did. Yet there s videos and tweets of democrats inciting the BLM Antifa mobs

 If you see any member of that cabinet in public shopping or at the gasoline station you get out there and you get in their faces and you push back. You tell them they are not welcome here or anywhere . Maxine Waters This is the start of the gaslighting. Because they think it ll win them some elections.

Even the event itself wasn t that violent besides protestors themselves getting hurt. They basically walked in because police allowed them. You don t need him to out and say  Go and attack the Capitol  it s been 6 7 weeks of hyping everyone up about election fraud. It was Giuliani that wanted  Trial of combat  It s been 4 years of non stop insanity. Twice a week this guy does something crazy that pushes the crazyness he did last week into old news and nobody can keep up. He throws these wild statements out and before anyone can fact check him he s bumbled off to the next thing he can fuck up royally. The incomplete transcript conveniently left out the part where he says
  if you don t fight like hell your not gonna have a country anymore 

If you are gonna defend trump then post the whole speech   otherwise you are fake news Last 4 minutes of the speech. He said  and we fight. We fight like hell. And if you don t fight like hell  you re not going to have a country anymore .

https   m.youtube.com watch v lBH7ql34Ex0 Liberal logic  they all ran top speed to get there  I ll start by saying I don t think Twitter and Facebook made the right call here for a bunch of reasons but that s a large discussion.

The bigger point is that the president and a group of like minded senators and house reps are perpetuating a lie that is threatening to undercut our democracy and has already destabilized our society. Trump made up the election fraud allegation because he is a preposterously sore looser and is used to getting what he wants by steamrolling through the impediment. Hopefully he met his match with American Democracy. 

Based on this preplanned  list ditch effort  Cruz and Hawley lead the charge on the senate floor under guise of  answering the questions that their constituents want answered  because they will both run in 2024.  They are a  working to inherit trumps base because they believe that part of the electorate can get them at least the republican nomination and b  appeasing trump the man because there is a good chance he will stay have a lot of sway in the republican establishment. The house reps are following suit because they will likely loose their seats  now that their increasingly radicalized constituents see their beloved leader doing this  if they don t follow Trump and the Cruz   Hawley team into the abyss.

As Mitt Romney  he used to be a hero around here  said on the senate floor directly at Hawley hours after the riot  leaders in those positions of power need to do the right thing and tell their electorates the truth.

I say all of that because I want to implore you to come up one level and think about the bigger picture. Please put real respect for the democratic process above your love for one political leader. It s the only way out of this. Thanks for posting this  He never did. It is a contrived narrative of rhe left. He didn t.  The leftist media makes shit up and sadly there are a lot of naive people out there They know he didn t. This is a power grab by the left.  removed  it s not just in one day. It s been an accumulation of what he s said and done. If you ve tolerated or ignored these in the past  I doubt any argument will convince you. This is very sad but hey  it s America.

 https   www.vox.com 21506029 trump violence tweets racist hate speech  https   www.vox.com 21506029 trump violence tweets racist hate speech 

 Trump urged the crowd to march on the Capitol  even promising to go with them  though he didn t in the end. He said    you ll never take our country back with weakness  .  Trump s words followed a speech by his personal lawyer  Rudy Giuliani  in which the former New York City mayor said     Let s have trial by combat  .  

Remember  rhetoric is very powerful bcos it doesn t have to be direct.

Trump s tweets and statements after the terrorist attack even empathized with the terrorists.

Although the case may not be strong enough for an indictment  I strongly believe Triump intentionally incited the mob and still has no remorse.",
t3_kvth8k,Bullies,https://www.reddit.com/r/conservatives/comments/kvth8k/bullies/,Rules for thee  not for me The collusion here is as dangerous as the monopoly. This is blatant antitrust If what someone is saying is so incorrect  you can freely debate it and explain to them how they are wrong. Putting duct tape over their mouth just means you re scared of what they re saying because it s ruining your narrative Big Tech is  so disgusting Despotic tyrants  I mean yea  these monopolies are a problem but they are not required to host the app. Still pretty ridiculous though Modern day brown shirts. Absolutely  the issue is most talented coders don t graduate from Hillsdale or Liberty... they come from MIT  Stanford  etc.  Soo... if you used Parler  the interface sucked  the authentication process was stupid  and I doubt anyone without a double digit IQ wants to support a platform which allows to people to post about feeding women and children into wood chippers.  Just a thought  before you talk about your own platforms... let s eliminate the domestic terrorism support and brainworm Qanon crap in the GOP.  Just a few thoughts from a lifelong conservative who thinks you all have lost your damn minds. It s important to note that there were a lot of terrible threats of violence that were being made on Parler that were not being moderated. While the umbrella of it all signals that its conservative censorship  conservative voices also need to focus on the fact there were plenty of terrible things being said on the platform. If that s the standard to moderate by then fine. No one should defend  organize  or threaten violence for political means or otherwise ever. Then  however  this needs to be the standard for all to follow when the Ayatollah advocates for genocide as an example or when death threats are made against any voice on these platforms  etc. etc. etc. The question is  how can we all find a way to reconcile and agree to a set of principles that everyone can use to declare something is wrong to say or do regardless of where that person s political affiliation is  Terrorist,
t3_kvsq5f,Facebook confirms data sharing agreements with Chinese firms,https://www.reddit.com/r/conservatives/comments/kvsq5f/facebook_confirms_datasharing_agreements_with/," The agreements gave the Chinese firms some access to users  data to help them build Facebook  experiences  on their smartphones.

Facebook said all the data collected remained on users  phones not server ..

Like I believe Mark... The Chinese social credit score system  Who do you think designed it  and implemented it  Here s a hint.. It s in a valley in the bay area.. I m barely using my FB anyways That  s relevant but from 2018. They re still doing basically the samething selling personal data outside the UK and Europe. WhatsUp included in that. Article from last week.

https   www.bbc.com news technology 55573149 Oh I am so shocked. I think the CCP high party members trade Americans like Pok mon cards  I trade my Dorsey and Zuckerberg for a Biden. Joe not Hunter don t want blow my pay off budget on hookers and cocaine.  I banned Facebook from my life years ago when they started befriending ccp maggots  Isn t Reddit partially owned by the Chinese also ",
t3_kvcfmm, NorthKoreaDPRK,https://www.reddit.com/r/conservatives/comments/kvcfmm/northkoreadprk/,And the man NEVER got any recognition  except from us  for the peace agreements he made. I don t have pity for such a strong willed and strong minded person  but the tragedy is that he IS a highly successful president and a majority of the nation will never know that because they take their  facts  at face value and keep scrolling. The times we live in when an existence that has accomplished so much can be overlooked at the swipe of a thumb. Doesn t he have a press briefing room  He can do a press conference anytime he wants. How is that silencing him  The social media platforms are private  non state owned companies . Trump can hold press briefings and release statements. The first presidential tweet was is 2015. He can just walk to his podium and start talking. He is not silenced  He could also go to the Press Briefing Room in the White House and speak to whatever reporters   I m sure it would be covered  but maybe he just doesn t feel like it  Thats why u dont attack united states of america or congress All major social media outlets are American. So there s that.  removed  Probably because he literally just prompted treason. He should be silenced.,
t3_kvthk8,Businesses That Went Woke After Capitol Riot  Downplayed Floyd Riots,https://www.reddit.com/r/conservatives/comments/kvthk8/businesses_that_went_woke_after_capitol_riot/," Buden calls for unity   companies hear  Biden calls for conformity  and get in lock step. Parler was the example of what they will do to you if you don t. 

What is even scarier is the number of individuals out there cheering these sort of actions on. This will not end well. They bent the knee last year  no one should be surprised Businesses   

yeah  try people too.    I have a sister and brother losing their minds right now over what happened last week.

BLM    that was proper. PR  marketing  perception. Insecure ceos who are more worried about being  loved  than serving their customers. Do not confuse their blacklisting as being patriotic it is about THEM",
t3_kvtfga,Bye Bye Best Buy,https://www.reddit.com/r/conservatives/comments/kvtfga/bye_bye_best_buy/,"In answer to your question  China. They re worried about their bottom dollar. They ll virtue signal now with current headlines. They ll ease up later. Virtue signalling doesn t mean crap when the corporate tax rate starts going up or regulations increase.

Not surprised with Verizon. They got a European CEO  a unionized workforce and own the likes of Yahoo. Hallmark eh  I don t pay 4 dollars for a greeting card you can get them at dollar stores. 

Virtue signaling for dollars Fascism  When corporations control government...... Same with Hallmark and Verizon.


Edit to add 

Now Stripe and Salesforce Are Cutting Off Trump and Restricting the RNC

So now  the WSJ is reporting that Stripe has cut off the ability of the Trump campaign to process payments for President Donald Trump s campaign website and online fundraising apparatus. The report claims Stripe is cutting off the president s campaign account for violating its policies against  encouraging violence.  


The Trump Campaign uses Exact Target  which is an email marketing firm owned by Salesforce and the emails are sent in conjunction with the Republican National Committee. Salesforce now says they took  action  to  prevent its use of our services in any way that could lead to violence.  

https   redstate.com nick arama 2021 01 12 308609 n308609 Fuck Best Buy It all comes down to the dollar  we need to carefully choose where we spend our money  and it s not with companies like this. Goddamnit  Verizon is my phone provider   second class citizens We re going to start seeing credit card companies  just like Stripe  banning purchases of subscriptions to conservative news and other businesses supporting conservativism. If we do nothing and allow this to keep happening then we are now China. Welcome to the Great Reset ",Best Buy just pulled funding from the congressional members who voted against certifying Biden as President. And American Airlines just tried to kick Republican passengers off its planes. People are being discriminated against for their political beliefs now  Is this America or China 
t3_kvs1oh,Limbaugh   Titans of tech  are now running America    Says Congress sold out for  good search results  and  campaign donations ,https://www.reddit.com/r/conservatives/comments/kvs1oh/limbaugh_titans_of_tech_are_now_running_america/,"They only were allowed to do so because the populace became lazy and craved convenience and ease of use over freedom and protection of individual rights. He s right and it s not just donations to candidates and parties. Over the last several years Facebook has lobbied for on over 2 dozen bills. One bill they had over 12 issues they wanted addressed or not addressed in the bill.

https   www.opensecrets.org orgs facebook inc lobbying id D000033563 amp lobbillscycle 2018 It s crazy but true.  Big Tech is running the country now.  Also China basically runs us too now.  Hope people who voted blue are happy.  Although I bet in a few months many of them will regret it",
