name,title,url_comments,comments,selftext
t3_kqqhqq,Facebook is now labeling out video showing confessions that thousands are registered to vote at one address in Atlanta as...  against our Community Standards on adult Sexual Exploitation    James O Keefe,https://www.reddit.com/r/conservatives/comments/kqqhqq/facebook_is_now_labeling_out_video_showing/,"If true  the censorship of such posts using a criteria that does not apply should be among the reasons to remove the safe harbor provisions for social media.

An immediate justification explanation for such acts should be provided.

WE need transparency of exact rules violated.  If you can t point to a time frame of the video that backs your claim  they need to allow posts to be made or face removal of the safe harbor provision. Huh   sexual exploitation   Is that the residential address that is a large apartment building with a Mailboxes Etc shop on the ground floor  Sick Does anyone have a link to the video that was banned  1. Ridiculous
2. Thousands of homeless use charity address to register to vote. What s the legality on that  1000s at one address   orgy is why",
t3_kqy8ww,BLM harassing Senators Hawleys house while he s away  wife and newborn alone home.,https://www.reddit.com/r/conservatives/comments/kqy8ww/blm_harassing_senators_hawleys_house_while_hes/,It s called a shot gun. Have you met it  Teach your wife to use it. This is dangerous stuff  for the republic. did she call the cops  So where s the cops  This is why the second amendment exists. Shoot them. That s not even his house lol.,
t3_kr0uxp,Democrat Election Fraudster BUSTED  Admits to Registering Countless People Using Same Address in Georgia   I Can t Even Begin to Tell You How Many People Have That Address on Their ID  . . .  We ve Done That for Years ,https://www.reddit.com/r/conservatives/comments/kr0uxp/democrat_election_fraudster_busted_admits_to/,"Waiting for the evidence..... Just to ask what should be done here   The article is describing how a outreach program registers homeless people for state IDs and then to vote.  In their process they are allowing the homeless person to use their ID as their permanent address  in lieu of a better alternative.  They mention that this is not a new process and has been standard protocol for years.  

Checking Georgia s law on this a homeless person can go to any Indigent Resource Provider for an id and to register to vote.  Examples of such places are churches and advocacy groups.  The only benchmark is that the homeless person can respond to mail received at the address.  This is meet by most advocacy groups holding onto mail sent to them in the homeless persons name.

If this seems shady to you I would question what a better method for allowing homeless persons to vote would be  Homeless people absolutely have the right to vote too you know.",
t3_kqfxt7,DC mayor calls in National Guard for protests Jan 5 7  something she refused to do during BLM riots.,https://www.reddit.com/r/conservatives/comments/kqfxt7/dc_mayor_calls_in_national_guard_for_protests_jan/,"Now a conservative can t protest. First they silence you on the internet and now they re taking away your right to protest.

How do these people keep getting away with this nonsense  Well good thing she isnt in control of anything. Political grandstanding. 

 gt  Because D.C. does not have a governor  the designated commander of the city s National Guard is Army Secretary Ryan McCarthy. Any D.C. requests for Guard deployments have to be approved by him.

 gt  The defense official said that there will be no active duty military troops in the city  and the U.S. military will not be providing any aircraft or intelligence. The D.C. Guard will provide specialized teams that will be prepared to respond to any chemical or biological incident. But the official said there will be no D.C. Guard members on the National Mall or at the U.S. Capitol. Hypocritical  but at least it  hopefully  will protect our side when the left brings knives and starts fires. Nothing really surprises me anymore Let s be real  they were probably gonna be there anyway  most servicemen are conservatives The same scum who paint blm on the streets. Typical Seriously  AntiFa and BLM and other assorted thugs have been busting up the place all summer  and now she s all worried about Trump supporters    I hate these people. Nothing like a representative picking and choosing how people get treated based on their political bent. Sure bodes well for the future. These democrats are such spineless cowards  so worried about the proud boys when in fact the proud boys haven t committed a fraction of the violence and damage that ANTIFA and BLM  burn  loot  murder  have already committed. Wow.. They are so hypocritical.. Hypocrite Bias piece of shit What a Jackass. Fear.  This is someone who is scared. This is false... the national guard was called in.  https   www.vox.com 2020 6 11 21288006 black national guardsman discomfort enforcers black lives matter protests george floyd  https   www.vox.com 2020 6 11 21288006 black national guardsman discomfort enforcers black lives matter protests george floyd  Good. They ll prevent the BLM Antifa scum from attacking people at a peaceful demonstration. Something they know nothing about. The national guard is always called in during this time during an election year. Democrat bitch partisan shit. I think it s probably warranted. Better safe than sorry.",
t3_kqqb3t,Tonight while I was in Missouri  Antifa scumbags came to our place in DC and threatened my wife and newborn daughter  who can t travel. They screamed threats  vandalized  and tried to pound open our door. Let me be clear  My family  amp  I will not be intimidated by leftwing violence   Josh Hawley,https://www.reddit.com/r/conservatives/comments/kqqb3t/tonight_while_i_was_in_missouri_antifa_scumbags/,"I hope she was armed. If someone breaks into my house  I have already made the decision that they will be shot. I m not going to be trying to ask them questions or trying to reason with them or anything thing else. I will keep pulling the trigger until they are down or gone from the house. This is why antifa needs to charged with domestic terrorism and do actual prison time. That s what guns are for.  Stand up  fight back  shoot straight. 

Keep standing for what is right.  removed  Always pack your gun. If they try to get in the vehicle  that s when you shoot. Seems pretty suspect since it just came out he currently doesn t even have a home in Missouri and registered at his sisters house in Ozark to vote in the 2020 election. He claimed a month ago when the news came out he was in the process of building one. 

https   www.kansascity.com news politics government article247260219.html This is a lie.",
t3_krcu3h,San Francisco s experiment with  progressive prosecution  is a total failure,https://www.reddit.com/r/conservatives/comments/krcu3h/san_franciscos_experiment_with_progressive/,"Multiple examples with this  DA  and he doesn t even have one full term yet. His latest woke moment cost 2 innocent people their lives

https   sanfrancisco.cbslocal.com 2021 01 05 update san francisco hit and run suspect pleads not guilty some calling for da boudins job 

And how the pedo escaped charges or a plea deal is ridiculous.",
t3_kr41hc,Pro GOP Georgia Battleground Fund raises  58 million in runoff showdowns,https://www.reddit.com/r/conservatives/comments/kr41hc/progop_georgia_battleground_fund_raises_58/,,
t3_kr0swp,Epidemiologist Says Influenza Cases Are Being Counted as COVID 19,https://www.reddit.com/r/conservatives/comments/kr0swp/epidemiologist_says_influenza_cases_are_being/,You don t say   Make sense when they also count gunshots  car crashes and heart attacks as Covid cases. In Australia the drop in the flu is due to better health practices during covid  wearing masks  social distancing and the washing of hands. You don t Need a doctor to tell you that one type of flu can be counted as another when all you have is highly inaccurate tests... But it is good that some are telling the truth.,
t3_kqyhsp,Trump  Democrats Will Turn U.S. into  One Party Country  if They Win Senate Runoff,https://www.reddit.com/r/conservatives/comments/kqyhsp/trump_democrats_will_turn_us_into_oneparty/,Indeed. We re sitting at a very dark junction and our future is not looking good. I don t know what is in our future but certain words of Thomas Jefferson seem more and more credible as the days pass. I fear for this nation. already is cant tell difference between the two now I was concerned about this.  Now I have the mindset that let them blow up the country and I believe it will seriously back fire on them.  deleted  Maybe next time try candidates who aren t crooks  If they spent less time enriching themselves via insider trading and more time looking out for their constituents  maybe things would have been different. Just a thought. Good.,
t3_kqnl9e,Report  400 ex intel officers investigating 2020 election     Fraud was so massive and so blatant  despite what mainstream media said ,https://www.reddit.com/r/conservatives/comments/kqnl9e/report_400_exintel_officers_investigating_2020/,Aaaanndddd...    Is someone gonna do something about it  When 50 former intel officers claimed Hunter s laptop was  Russian disinformation  the media parroted that right  left and sideways.   Here s 8x as many former intel officers making a claim  where s the media     The question is rhetorical. Then show us this widespread and blatant fraud.,
t3_kqoypc,Trump   There s No Way We Lost Georgia  That Was a Rigged Election ,https://www.reddit.com/r/conservatives/comments/kqoypc/trump_theres_no_way_we_lost_georgia_that_was_a/,What about the house gains by Republicans  Or those misses in the Senate races that Dems were sure they d win  Lindsey and Susan... lookin their way . I mean  if their gonna rig the election  they probably would have locked up the whole deal right  Said the guy that golfed while 350 000 citizens died and millions more got sick. His  It is what it is  attitude maybe hurt him a little bit He says  while presenting no credible evidence. Enough already. He speaks the truth  It was stolen  but I still think we re gonna win  Fight for Trump     Yeah  only a real moron republican could lose Georgia ,
t3_kqp067,Saudi Arabia to end feud with Qatar in Jared Kushner brokered deal,https://www.reddit.com/r/conservatives/comments/kqp067/saudi_arabia_to_end_feud_with_qatar_in_jared/,,
t3_kqk5f0,Supreme Court of Texas to Austin mayor  You don t get to make your own rules during the pandemic,https://www.reddit.com/r/conservatives/comments/kqk5f0/supreme_court_of_texas_to_austin_mayor_you_dont/,Say it louder so Clay Jenkins will hear it. Maybe slower or spell it out also. Seriously. Stop messing with Texas. Can Michigan use your Supreme Court too ,
t3_kqqp6l,Liberals a who new breed of stupid,https://www.reddit.com/r/conservatives/comments/kqqp6l/liberals_a_who_new_breed_of_stupid/,, 
t3_krbfjq,McConnell to GOP Colleagues   I Won t Judge Anybody for Their Decision  in Electoral College Certification,https://www.reddit.com/r/conservatives/comments/krbfjq/mcconnell_to_gop_colleagues_i_wont_judge_anybody/,That s okay. We ve already judged Mandarin Mitch. Flip flopping ,
t3_kq8jz0,No  Mocking The Chinese Communist Party Isn t Racist    Useful idiots on the American left are running cover for China s murderous regime.,https://www.reddit.com/r/conservatives/comments/kq8jz0/no_mocking_the_chinese_communist_party_isnt/,"Chinese American here  fuck the CCP. Those sacks of shit tried to kill my grandpa and they can all die in a fire for all I care. The Chinese people have lived under their bs for decades. Useful idiots like  this reporter  https   youtu.be dl78PQGJpiI  are quicker to condemn Trump for saying China virus than they are to condemn China for saying our military spread it to them Are you absolutely sure that they re all useful 

Some of them might just be idiots. They protect what they want the US to become Idiots  the CCP is laughing at them They re a bunch of hypocrites   For the life of me  why in the hell do they support the Chicoms    CCP  The level of hypocrisy and hyperbole coming from the left on almost every single issue has abandoned the realm of common sense long ago  but especially relating to communist China  islam s treatment of women and climate change critical thinking. I have a feeling that Biden is going to invite CCP Peoples Liberation Army units to come as  peacekeepers  to help enforce his edicts in the United States. Rules for thee  but not for me   Seeing how truly evil the demon ratic party this year is has truly opened my eyes.  Nancy Pelosi  Schmidt and the whole left. They openly hate whites  jew and support evil criminals who ran amuck Burning  Looting  and Murdering during a pandemic.  They tell us we need to embrace their 1000 sex identities  embrace warping kid s minds  and kill precious babies in the wounds.  They tell us if we aren t going to pay for their every last mistake instead of behaving as good and decent humans  then we aren t Christians  etc. This is how stupid people get grifted into socialism and communism and by evil thieves. These last few years  they told us to bow to and say the names of such evil men and women like George Floyd and Breonna Taylor  who after looking who they were and how they behaved gives me every reason to simply want to forget about them and never care about their lives that absolutely matter in a negatively impactful way.  And last but not least  the CCP is evil  and influencing Silicon Valley  elections  and every aspect of our lives now.  Time to turn our backs forever. CCP is totally bad   but when you see some of the stuff Trump says it seems like he would enjoy their power.   It s not racist to point out the iron fist of control they have over all Chinese people.  They will even take on Chinese Americans who speak out.  We must separate the government of China from the people of China.  Same as the USA  we don t control these politicians they run us over. Mocking the Chinese as a people is racist.

Mocking the Chinese Communist Party is probably nationalist.

...but...

Being critical of the Chinese Communist Party is probably humanitarian. If we don t organize and fight immediately  the murder will come here. Owned mind and soul by Chinese money Nah when you spell it out for them most dems  libs and lefties say fuck the CCP. Can t deal with ideologues though  ironically they re fucking proles when it comes to this.  removed ",
t3_kqnkrj,WATCH  Pence inspires Georgia with personal Christian testimony    Things still  going the way HE expected ,https://www.reddit.com/r/conservatives/comments/kqnkrj/watch_pence_inspires_georgia_with_personal/,Keep religion out of government. That s one of the founding principles of America.,
t3_kqox5o, Fweedom   Kamala Harris Story About Demanding Civil Rights As Toddler Lifted From 1965 MLK Jr. Interview,https://www.reddit.com/r/conservatives/comments/kqox5o/fweedom_kamala_harris_story_about_demanding_civil/,She is an absolute phony. She learned how to plagiarize speeches from  Joe .,
t3_kqm01a,Kurt Schlichter  I m Not Unifying    What happened in November 2020 was a mammoth scam and disgrace  and our na ve Constitution  with courts demanding standing and a presumption of regularity and all that old fashioned stuff  was unable to deal with the outright  blatant steal.,https://www.reddit.com/r/conservatives/comments/kqm01a/kurt_schlichter_im_not_unifying_what_happened_in/,It actually is able to  the legislatures let us down  the fatal flaw with the constitution is it assumes we are a moral people  when you have no morals from top to bottom  what good is it  Sure. Imagine a world where the US split into two different countries. The red and the blue. The blue would be called the Peoples Republic and the res would be the United States. The PR goes full woke socialism  tramples on everyones rights in the name of equity and justice. Meanwhile the US prospers. Hmm  sounds like a good book series.,
t3_kqkbxp,Ohio Gov. Mike DeWine signs  stand your ground  bill,https://www.reddit.com/r/conservatives/comments/kqkbxp/ohio_gov_mike_dewine_signs_stand_your_ground_bill/,He s trying to appeal to the base because everyone in Ohio hates this little worm. All states should be stand your ground states Hes done after his lack of leadership and his poor handling of the China Flu.  removed ,
t3_kqz3rm,Is the ultimate Republican Party failure theater about to happen ,https://www.reddit.com/r/conservatives/comments/kqz3rm/is_the_ultimate_republican_party_failure_theater/,As long as the Republican members of the Uniparty get have their perks for being in Congress  they don t care about the American people  any more than the Dems do. Yep. I guess the Democrats were ultimate fails in 2000  2004 and 2016. I am not reading the article  but I find it hilarious that is has a picture of the constitution  as if anyone cares about that these days  aside from a select few.,
t3_kqk6c7,The book Silicon Valley tried to kill  ABIGAIL SHRIER S investigation into the exploding numbers of girls wanting to change sex has caused an outcry in America   but her story must be heard,https://www.reddit.com/r/conservatives/comments/kqk6c7/the_book_silicon_valley_tried_to_kill_abigail/,It s sick,
t3_kqy547,At Georgia rally  Pence says America will  hear the evidence  of election fraud on Jan. 6,https://www.reddit.com/r/conservatives/comments/kqy547/at_georgia_rally_pence_says_america_will_hear_the/,But  Will the MSM allow America to hear it  Pence is playing y all. He s just trying to find his time to kill the king. Just wait.,
t3_kqp4no,Congress and election fraud    If Biden was fraudulently elected  the American people will find out.,https://www.reddit.com/r/conservatives/comments/kqp4no/congress_and_election_fraud_if_biden_was/,"This is just theater to show republicans they tried. We already know he was fraudulently elected. The US is an Oligarchy now because all 3 branches have conspired against the constitution for decades. We already know. Think about how incredibly huge our beaurocracy has become In the country  think about what you would need to do to start fixing the government. Unfortunately  we have no rights  no constitution  no country. Like Benghazi   The American people will find out  

What an absurd statement.   Roughly half of the voting public don t care if there was election fraud or not because Orange Man Bad.

Anybody who does actually have questions about this election have been told by the courts and the  justice  system that they aren t interested in even looking at the evidence.",
t3_kqk4ig,New York Democrat s bill allowing governor to detain individuals dangerous to  public health  sparks backlash,https://www.reddit.com/r/conservatives/comments/kqk4ig/new_york_democrats_bill_allowing_governor_to/,Can you say   Internment Camp   Is anyone in NY really surprised at this    When are they going to start dragging these POS politicians out into the street  No  I m not kidding. Not that I really need another reason to never visit New York again.,
t3_kqkxa1, Utter Chaos   Pelosi Abandons Coronavirus Restrictions At House Swearing In Ceremony,https://www.reddit.com/r/conservatives/comments/kqkxa1/utter_chaos_pelosi_abandons_coronavirus/,"Rules are for thee  not for me. She allowed a Rep who has COVID attend in person because she needed their vote to keep her speakerphone 

They buried the lede with that. Her designer and always matching face masks are infuriating",
t3_kr7pop,Where can I watch a live stream of the DC protest ,https://www.reddit.com/r/conservatives/comments/kr7pop/where_can_i_watch_a_live_stream_of_the_dc_protest/, stop the steal  https   youtu.be s5ScxwgOxAg  Youtube lol There a huge storm there right now gonna be hard to get real good quality from small outlets. Lots of video of Trump supporter attacking cops. That Back the Blue lasted all of a couple weeks. Shocker.,Lots of people headed to DC. Is there a live stream of the event anywhere 
t3_kqydco,Why I Am Joining The Jan. 6 DC March For Trump    On Nov. 4  2020  I suddenly saw with my own eyes the depth and breadth of the political corruption myself and others had tried and failed to prevent for so many years.,https://www.reddit.com/r/conservatives/comments/kqydco/why_i_am_joining_the_jan_6_dc_march_for_trump_on/,I would take the up most caution at any kind of protest march or rally.What ever you want to call it.full face respirator and hand cleaner.Some PPE. Wow armchair patriots have been fighting for years huh ,
t3_kr29gf,Defund the Police Group Donor MacKenzie Scott Named  Philanthropist of the Year ,https://www.reddit.com/r/conservatives/comments/kr29gf/defund_the_police_group_donor_mackenzie_scott/,It s a great idea until she needs to call the police. She is rich because she spread her legs for a man and the man got tired of her. W.. T.. F... Super dumb.,
t3_kr6zql,Exclusive  Over 432 000 Votes Removed From Trump in Pennsylvania  Data Scientists Say,https://www.reddit.com/r/conservatives/comments/kr6zql/exclusive_over_432000_votes_removed_from_trump_in/,"This is truly incredible  I can t seem to find any info on the data integrity group that provided the info here. Does anybody know about their foundation  Were they hired to do this work  Is their information certifiable  Have they ever been used in court 

I m not accusing them of anything  just trying to figure out how legit this is considering the ramifications.",
t3_kqp7c0,So what did Nancy Pelosi promise The Squad     Pelosi was elected House Speaker on the narrowest of majorities  with only the far left squad putting her over the top. What did she promise them ,https://www.reddit.com/r/conservatives/comments/kqp7c0/so_what_did_nancy_pelosi_promise_the_squad_pelosi/,Covid Nancy Pelosi promised to deny them any campaign funds from the DNC war chest if they DIDN T vote for her   This is also how Chuck Schumer accomplished party line votes in the Senate even if constituents back home in some districts felt differently. Rumor about federal investigation Scary,
t3_kqkypa,Democrats Objected To Electoral Vote Certification In 2000  2004  2016,https://www.reddit.com/r/conservatives/comments/kqkypa/democrats_objected_to_electoral_vote/,Basically every time a Republican took office in this century.,
t3_krfv2u,Josh Hawley  If the Antifa scumbags can terrorize my family  they can do it to any family in America.,https://www.reddit.com/r/conservatives/comments/krfv2u/josh_hawley_if_the_antifa_scumbags_can_terrorize/,Fear mongering like this clearly has not been a winning strategy.,
t3_krh7v4,Votes disappearing from Perdue on video,https://www.reddit.com/r/conservatives/comments/krh7v4/votes_disappearing_from_perdue_on_video/,Any chance they made an error and gave Perdue too many votes only to fix it at the end  You realize that these aren t official numbers... It s some minimum wage kid typing this out at the new studio. Did this happen to the actual totals or just on ABC  If it was just ABC likely was just a mistake Its cheat by mail. Clear as day but the gop is gonna sit on their ass and do nothing. And look the other conservative sub is being hjacked by libs. We are slowly losing our free speech on social media. Is it possible that due the fact that was a different source the vote feed wasn t as up to date ,
t3_kqkdby,Democrats Prefer Intimidation  Rather than Validation of the Election Results,https://www.reddit.com/r/conservatives/comments/kqkdby/democrats_prefer_intimidation_rather_than/,"Excellent article. Missing from the list 
Intimidation   New York Attorney General suing to disband the National Rifle Association  a previously strong financial contributor to conservative politicians. They have to use intimidation because their game is weak.",
t3_kqm2sp,Mike Pence  Kelly Loeffler  David Perdue Would  Get in the Way  of Open Borders  Socialized Medicine,https://www.reddit.com/r/conservatives/comments/kqm2sp/mike_pence_kelly_loeffler_david_perdue_would_get/,This atheist is praying for them tomorrow   Don t care  sorry  the RePuBliCaNs do not speak for me. A small fraction care about common sense and the American people. Let them destroy the country since no one wants to stand up against fraud. I think they are all in on it  I think at least one RePuBliCaN will win no matter how many people vote. They ve told us this  especially this year  they told us how the election would go prior to the election  but couldn t get a poll within 10 points  we are no longer the united states of america  I m gonna head to Texas and hope the secede Why would anyone vote in some vapid Barbie who likes to pose with KKK members  Pence is absolutely correct on this one.. Republicans in Georgia are literally the only thing we have standing in the way of liberal socialist policies demanding better education  health care  and workers rights. They must be stopped or nothing will stand in the way of freedom loving corporations and elite Real Americans. Please  I certainly hope so.,
t3_kqy7i3,Sen. Josh Hawley Says Antifa  Threatened  Wife  Newborn Daughter,https://www.reddit.com/r/conservatives/comments/kqy7i3/sen_josh_hawley_says_antifa_threatened_wife/,Why would antifa be supportive of the democrats  Makes no sense  if you can call one party facist they are both facists  and the Dems have the entire Hollywood  media and big tech  but to actually succeede as antifa   looking for a revolution  you would want everything that is happening to happen,
t3_kqdu87,Biden Promises Nationwide Mask Mandate And Womandate,https://www.reddit.com/r/conservatives/comments/kqdu87/biden_promises_nationwide_mask_mandate_and/,"Too possible to be considered satire. One word  LOL Biden is promising me a woman to date       Gotta luv the Bee Lol

Womandate. I hope this becomes a word  removed ",
