name,title,url_comments,comments,selftext
t3_knhk48,Rep. Michael Waltz  If Democrats Win Georgia  They Will Nationalize Lockdowns,https://www.reddit.com/r/conservatives/comments/knhk48/rep_michael_waltz_if_democrats_win_georgia_they/,They ll stack the courts  too  so the court won t rule against the constitutionality of it. It s game over for America if the radical Marxist democrats steal the presidential election and then go on and steal the GA senate elections. They will control all the power and will never again give it up. With no consequences for cheating and massive voter fraud there will never be free and fair elections again. We will have open borders  high taxes  expensive gas and energy  free healthcare for all illegal immigrants  loss of freedoms  massive censorship  racism re education training for everyone  20 million plus new citizens  abortion on demand  and an aristocratic totalitarian elitist regime government owned by China.,
t3_kneks1,Here are the Republicans planning to challenge the Electoral College results,https://www.reddit.com/r/conservatives/comments/kneks1/here_are_the_republicans_planning_to_challenge/,"This is nice to see but there should be dozens more. If the tables were turned Democrats would be 100  united. Why cant we  Rock   Did not know Yvette Herrell from NM 2 was objecting. Nice. Hawley makes me so proud to be a Missourian Gutless Republicans in Washington state.  Pathetic. Love seeing my Rep on the list. Avengers assemble  Why do progressives tend to be democrat and not republican  Well   why aren t there more progressives with republican views   I mean. 

Is being republican just more restrictive for many ",
t3_ko2oq4,Does anyone thinks it s likely that josh hawleys plan could work,https://www.reddit.com/r/conservatives/comments/ko2oq4/does_anyone_thinks_its_likely_that_josh_hawleys/,It has to earn a majority vote in the senate in order to throw out the contested votes  and Mandarin Mitch has already said he s going to vote it down. No chance it passes the senate  but Hawley is securing his future with Trump supporters. I very much doubt it. I believe it will work because of the debate portion afterwards.,Will it actually be possible for the GOP to get the presidential vote to congress  one vote per state  
t3_knuy96,Hunter Biden and the  big guy   the anatomy of a foreign enrichment scandal,https://www.reddit.com/r/conservatives/comments/knuy96/hunter_biden_and_the_big_guy_the_anatomy_of_a/,,
t3_knwyy8,McConnell again blocks quick vote on  2 000 stimulus checks  slams  socialism for rich people ,https://www.reddit.com/r/conservatives/comments/knwyy8/mcconnell_again_blocks_quick_vote_on_2000/,For fucks sake Mitch Come on man  do something for the American people or you re going to get thrown out of your job.,
t3_knwy39,Donald Trump  Michelle Obama most admired  Gallup says,https://www.reddit.com/r/conservatives/comments/knwy39/donald_trump_michelle_obama_most_admired_gallup/,Gallup is full of shit.  They do this polar opposites so people go crazy.  Lol.,
t3_knwpjk,No BS  just facts,https://www.reddit.com/r/conservatives/comments/knwpjk/no_bs_just_facts/,,
t3_knb9m1,After Walmart Twitter Account Attacks GOP Sen. Josh Hawley   BoycottWalmart Trends On Twitter    Sen. Josh Hawley slammed Walmart on Wednesday after an employee used the company s account to insult the Republican congressman from Missouri for raising questions about 2020 election integrity.,https://www.reddit.com/r/conservatives/comments/knb9m1/after_walmart_twitter_account_attacks_gop_sen/,"I wonder how many Chinese slaves Wal Mart is using How many will only talk about it and not be about it  Don t be a Twitter slacktivist  take your business elsewhere   mom  amp  pops are a great alternative  Josh hawley a pos tho I ve never been fond of Wal Mart ever since they moved to satisfying their investors over keeping things made in America.

That  and the store near my house has seen some serious shit. 1 hostage situation  1 drowning  2 stabbings with robbery  1 gun robbery  and the cherry on top was the dead elderly woman they found in her running car. She had evidently been dead of a heart attack while getting ready to head back and no one bothered to do a wellness check until 3 days later in the hot Florida summer sun. Strange that this is the first time Hawley ever criticized Walmart s business practices.  He s never introduced or supported any legislation to stop Walmart s slave labor practices but he brings it up now.  It s as though he doesn t actually give a fuck and is only tweeting this for cheap political points.  Does he really think his supporters are this stupid   ",
t3_kn2dok,The Top Five Most Suppressed News Stories Of 2020    There s no way that even as recently as four years ago anyone would have predicted just how abysmally irresponsible the media would become by 2020.,https://www.reddit.com/r/conservatives/comments/kn2dok/the_top_five_most_suppressed_news_stories_of_2020/,"Not irresponsible  intentionally malicious and agenda driven Good article.  Pretty much anything good that happened that could be linked to a Trump policy was downplayed.  And that includes a long list of things  The economy  minority unemployment numbers  the stock market  GDP  relations with North Korea and other foes....all of this and much more systematically downplayed by all the hate mongers who loathe Trump and despise our own country. The media no longer reports news. They have become a PR agency for the democrat party. I could. 

It s called. . .

cnn. Seriously  why are we not protesting at MSNBC  CNN  etc.   These people are not just lying to us  but are literally swaying public opinion in a very dangerous direction. Excellent article about the sad state our country is in today. The media are a shower of c nts  the enemy of the state  complete biased liberal satan worshipping b stards This is very true and makes me depressed It s plain evil. None of those stories were suppressed by the media. All received a very thorough airing out in various media sources  both mainstream and fringe  from many different points of view. What you really mean to say is that your particular views were not universally acclaimed as the absolute truth. Neither were mine  but the idea that any point of view is  suppressed  in the USA is ludicrous. Fuck Fox News",
t3_kneefq,Mark Levin   On January 6  We Learn Whether Our Constitution Will Hold   and  Whether Congressional Republicans Care ,https://www.reddit.com/r/conservatives/comments/kneefq/mark_levin_on_january_6_we_learn_whether_our/,"I think there are a few. They will wait until last minute to a avoid extra negative media attention. There has to be some  It won t. They don t. 

Lock and load and get ready for violence. It s coming. Are the courts  including the conservative Supreme Court  against the constitution for throwing out every single Trump lawsuit   If they are in on the conspiracy is there a political system even worth fighting for anymore  It seems a lot in the House do. The senate on the other hand... I think it won t  and they don t. 

I don t really think they give a damn. Very few politicians besides Trump do.",
t3_knyenx,Wannabe  Jeopardy   Host Ken Jennings Is A Kavanaugh Rape Truther Who Hates Republicans,https://www.reddit.com/r/conservatives/comments/knyenx/wannabe_jeopardy_host_ken_jennings_is_a_kavanaugh/,"I and a group of former co workers pass around his weekly email trivia questions.  Many are the weeks that I ve perceived some snark at conservatives.  This is not a surprise although the degree of nastiness in his tweets is.

Trebek was probably a liberal.  Johnny Carson was  probably Jay Leno and Jerry Seinfeld are. But you really weren t or aren t aware of their leanings  nor would you care because they weren t aren t attacking conservatives.",
t3_knr6h3,The Left Takes On God s Country    We stand at a time when the premise of our country s greatness is being challenged.,https://www.reddit.com/r/conservatives/comments/knr6h3/the_left_takes_on_gods_country_we_stand_at_a_time/,,
t3_knxagx,Kooky CNN Doc  Only  Regime Change  Will Get Pandemic Under Control,https://www.reddit.com/r/conservatives/comments/knxagx/kooky_cnn_doc_only_regime_change_will_get/,,
t3_knx9ly,Dick Thornburgh  former Pennsylvania governor and US attorney general  dies,https://www.reddit.com/r/conservatives/comments/knx9ly/dick_thornburgh_former_pennsylvania_governor_and/,,
t3_knx4g5,De Blasio calls NYC bike attack on SUV  absolutely unacceptable   says there will be  consequences ,https://www.reddit.com/r/conservatives/comments/knx4g5/de_blasio_calls_nyc_bike_attack_on_suv_absolutely/, laughs in doubt ,
t3_kn9ukr,SLAM  Sen. Josh Hawley Dunks on Walmart for Attacking His Election Objection,https://www.reddit.com/r/conservatives/comments/kn9ukr/slam_sen_josh_hawley_dunks_on_walmart_for/,China Mart  removed ,
t3_knsp51,Trump s Top 10 Accomplishments of 2020,https://www.reddit.com/r/conservatives/comments/knsp51/trumps_top_10_accomplishments_of_2020/,If the radical Marxist democrats steal the presidential election and the GA senate elections all 10 of these accomplishments will be reversed and or wiped out. Beijing Biden is already trying to take credit for the vaccine.,
t3_kn2ewa,How a Vindictive Classmate and a Cowardly University Ruined a Girl s Life    And how the New York Times helped justify it.,https://www.reddit.com/r/conservatives/comments/kn2ewa/how_a_vindictive_classmate_and_a_cowardly/,"Alan Dersherwitz said it s too bad the girl and her family didn t sue because she would have won. We need to Cancel this type of behavior.  gt  In fact  the context seems clear  Groves said it casually  as hundreds of hip hop tracks do every year. That doesn t excuse the behavior  which should be considered unacceptable.

Words aren t divided by race. Either it s an acceptable word or it s not. I hate the argument that only black people can use the n word. It s a disgusting word with a horrible history and no one should use it. And if people are going to use it to  take back the word   you can t be offended if it s used.  removed  Liberals  Black Lives Matter 

Also liberals  Wtf  You can t say the n word   This is the most accurate title for the story. Some say  caved in to hysteria  but cowardly sounds like the right word. So  the taxpayer supported University rescinded her admission for something she said years ago off the University campus   What business is it of state and federal government entities what people say and do outside of those entities 

This poor victim of political correctness and her family should have all of the tax dollars they paid over the years refunded to them.  First Amendment protected free speech should not result in the loss of being able to use to use a public taxpayer funded utility such as a public university.

The University s administration should be fired with no severance and their pensions revoked for this outrage. Clickbait title   no click",
t3_knzpgk,Trump Releases Video Update All of America Needs to See,https://www.reddit.com/r/conservatives/comments/knzpgk/trump_releases_video_update_all_of_america_needs/,,
t3_kneita,Boston Removes Lincoln Emancipation Memorial,https://www.reddit.com/r/conservatives/comments/kneita/boston_removes_lincoln_emancipation_memorial/,Maybe Boston should educate its citizens. If we continue to let the Communists destroy our cultural history piece by piece  in the end they will win.,
t3_kn7mu9,Federal judge lashes out at Trump  calls him  criminal     Jurist unleashes diatribe against president  could be violation of ethics rules,https://www.reddit.com/r/conservatives/comments/kn7mu9/federal_judge_lashes_out_at_trump_calls_him/,Ideology first.  What else would be expected.  Ethics  That is one very biased Democrat soon to be ex judge.  removed ,
t3_knh0sf,Greedy Health Care Providers Must Disclose Prices In 2021,https://www.reddit.com/r/conservatives/comments/knh0sf/greedy_health_care_providers_must_disclose_prices/,Good. If big pharma was also held accountable  and Medicare wasn t a thing  you d start to see prices fall all over. I think this may put an end to  45 kleenex, 
t3_knbncl,House Freedom Caucus Chairman Andy Biggs praises Hawley signing on to election protest      The Jan. 6 protest  will be the first time that the entire country won t be censored by the left wing media. We will be out there debating election fraud   Biggs said.,https://www.reddit.com/r/conservatives/comments/knbncl/house_freedom_caucus_chairman_andy_biggs_praises/,"This just in Andy Biggs suddenly dies from massive blunt force trauma due to covid. Exactly  now the entire world can see all the fraud. It is not wrong to be a patriot  but the leftwing media want the masses to think so. Be proud to stand up for traditional America.

Fight  Fight fraud  fight propaganda  fight censorship.",
t3_knbk7m,Sweden  Prime Minister Goes on Shopping Tour After Telling Swedes to Avoid Malls,https://www.reddit.com/r/conservatives/comments/knbk7m/sweden_prime_minister_goes_on_shopping_tour_after/,,
t3_kn7avh,Hey  fellow conservatives  Reddit recently banned r RightwingLGB after AHS flagged it down numerous times  similar to what happened to r RightwingLGBT. Am I welcomed here ,https://www.reddit.com/r/conservatives/comments/kn7avh/hey_fellow_conservatives_reddit_recently_banned/,"You are welcomed here by the vast majority of us but be aware of edgy homophobic teens The truly wonderful thing about conservatives that we can disagree on small issues and still welcome each other as conservatives. We re glad you re here. A few  may  have a problem  but it s usually  hate the sin  not the sinner  type of thing. The majority don t care about another users sexuality. 

One thing 99.999  of the users here cannot stand identity politics  so try to avoid that. You left the plantation... you cant unsee the light now. Of course  No left wing BS here... Besides the brigading sheep of course. But they re mostly fun to laugh at anyway   There s always room in the box car for one more    Reddit Admins probably Welcome  You are welcome and you may also like r walkaway To be honest  nobody here gives a shit about your  or any one else s sex life. Those were great subs. I think most of the members migrated over to Ruqqus 

https   ruqqus.com  RightWingLGBT I d welcome you but they don t like me over at r conservative. r conservatives seems less uptight though to be fair. I don t care where you come from or what you do. If you re cool to me then I ll be cool to you. Deal   deleted   removed ","I feel like Reddit doesn t like homosexuals like me who aren t exclusively left wing because it falls out of their stereotypical views of homosexuals. 

Just wondering if I m welcomed here. Reddit keeps taking my spaces away from me."
t3_kngeue,China s  unrestricted war  on the United States,https://www.reddit.com/r/conservatives/comments/kngeue/chinas_unrestricted_war_on_the_united_states/,,
t3_kn5gp3,Senator Josh Hawley  R   MO  Says He Will Object to Electoral College Certification,https://www.reddit.com/r/conservatives/comments/kn5gp3/senator_josh_hawley_r_mo_says_he_will_object_to/,,
t3_kna6lb,Thank you  Massachusetts  for making me a forever conservative.,https://www.reddit.com/r/conservatives/comments/kna6lb/thank_you_massachusetts_for_making_me_a_forever/,"Portland was my red pill.  I showed up somewhat disillusioned after running democrat campaigns  but slightly left leaning moderate.

Leaving portland in the summer as the most die hard voluntaryist libertarian.","As someone raised in a red state  the politics were there but never in your face  never hateful  never close minded to differing views. But moving to one of the bluest states  I became the  secret Trump voter.  

I have never felt such disdain for differing opinions as I do living in Boston. I would get beat up for expressing my views in public. I would probably get fired too. 

So thank you Massachusetts. I moved here as a centrist Republican who didn t care for political discord. And will be leaving as the reddest  most passionate conservative you will ever meet. 

Your ideas are garbage. Goodbye."
t3_kn881o,How much longer can the American people be silenced     The elites  system of corrupt politics can t last forever.,https://www.reddit.com/r/conservatives/comments/kn881o/how_much_longer_can_the_american_people_be/,Once we hit March 13  2021 people are REALLY gonna be done with this shit. A whole year of life wasted for everyone. People also are not going to give up another summer It s time to rise up  while Trump is still in unfortunately I don t think the American people will be silenced much longer. I think millions of Americans are fed up with a government that cares nothing for the American people and hates their country. A government of rich aristocratic totalitarian elitists. A government that is out of touch with its citizens. A government that is clearly corrupt. On Jan 6 if this government certifies the electoral votes for Beijing Biden with overwhelming evidence of voter fraud and corruption it will light the fuse for revolution. IMO it will start a civil war to remove this corrupt government.,
t3_kmthai,Jenna Ellis  Trump Denied  Due Process      Courts need to recognize that President Trump absolutely gets the same opportunities to argue his case that President George W. Bush did in 2000. ,https://www.reddit.com/r/conservatives/comments/kmthai/jenna_ellis_trump_denied_due_process_courts_need/,"This is the biggest abuse of power in American history  whats more is it showed us how much power the swamp really has. These people need to be stopped and it is only through action that they will be.

Patriots must act. Bush won Florida by less than 500 votes. Audits in Georgia now stands at 3.  Not once have Trump s team provided evidence  to any court  of voter fraud.  removed   removed  Hot Take from a Georgia Republican 

So let me be clear for everyone to understand. Here in Georgia the election was not stolen by Democrats and we lost the Presidential race. Saying otherwise undermines our democracy and prevents us from actually looking legitimate when we say  Cheaters   
I campaigned for the President and wanted him in office. It sucks what happened to my state. But we have to move on. This is enough of us trying to make water out of wine and its hurting us in the Georgia Senate races. Kelly Loeffler and David wont get the turnout they need if the President and his staff keep pushing this false narrative. Here in Georgia we cant get anyone to vote and legit we actually will lose the election if the President doesnt stop this. The Dems will control the Senate  house and Presidency. AOC NANCY AND SANDERS WILL PUSH WHAT THEY WANT    That is the reality if we dont pull out this win but the President keeps kneecapping us by pushing this and letting this slide.Its selfish to the party its selfish to Georgians and its selfish to America to keep dragging this out. Ok but also  what r we doin here B  He is hiring the exact same due process that Al Gore got.",
t3_knn3bq,What exactly does the  Covid Vaccine  file provide  which worries the Web ,https://www.reddit.com/r/conservatives/comments/knn3bq/what_exactly_does_the_covid_vaccine_file_provide/,,
t3_kn37cb,Oregon Governor Accused of Sending CPS to Salon Owner s Home After She Resisted Lockdown Order,https://www.reddit.com/r/conservatives/comments/kn37cb/oregon_governor_accused_of_sending_cps_to_salon/,,
t3_kn2elh,Watch  Joe Biden Calls Kamala Harris  President Elect ,https://www.reddit.com/r/conservatives/comments/kn2elh/watch_joe_biden_calls_kamala_harris_presidentelect/,"You guys think they took the cap off the needle and remembered not to have the syringe plunger already depressed when she got her  injection    I do bet Harris is savvy enough to remember which arm to pretend hurts at least. I give Beijing Biden 4 months tops before he is  retired.  I don t even have the words. Voter fraud Is the only way this guy got elected. Ahhh  yes. Another  fraudian  slip. This is certainly not the first time he  or a member of his team  has said this about Kamala. 

Most of us knew this was true way before the election.",
t3_kn86rd,China s Very Good Year    From manufacturing to Hollywood  the Communist Party has benefited from 2020 s chaos.,https://www.reddit.com/r/conservatives/comments/kn86rd/chinas_very_good_year_from_manufacturing_to/,,
t3_kmntvh,Supremes allow Trump to exclude illegal aliens from 2020 Census    Orders lower courts to dismiss 2 challenges,https://www.reddit.com/r/conservatives/comments/kmntvh/supremes_allow_trump_to_exclude_illegal_aliens/,"Wow  finally did one good thing. Hope California loses some congressional seats now Only common sense. Does other countries include their non citizens in their count. They say  allow  as if this should not be the harshest ass default rule of all government. 

Plot twist   it is for all other countries in the entire world.

Literally the etymology of the word  census  is a count of the  citizens.  For all time that term has implied that you are a native or otherwise authorized to have any rights in a nation. Great news Illegal aliens are not citizens. They can t vote. Census helps determine State and Federal Representative lines. How can they count if they can t vote   This seems like a punt not a final decision  But if the question was not allowed in the first place then how in the hell will they know who to exclude  I think this is a bullshit ruling to win favor with patriots  not falling for it  Arranging the last laughs. Easy solution   those that want to pay for illegal immigrants can contribute to a charity we will setup specifically for them.  All the bleeding heart democrats can donate as much as they want  even for poor people in other countries. Thank god for one positive thing to move us forward.

Thanks Mr Trump for making a move to clean things up. HALLELUJAH    They walk all over us  Why we allow them to walk into OUR land that we earned fairly in the first place is beyond me  Why they have the audacity to run away into OUR land because we have zero authority as the liberals have stripped away our defenses. I know they want to be Americans BUT they need to be going about  it the RIGHT way  

We need to make them take extenuous American tests to 
  make sure they speak 75  of American English  
  know the major laws and swear allegiance to the United States and 
  denounce Islam and Denouce Mexico or any counters they come From  
  They should know US History  the real history  not fake liberal history  and be able to pass a drivers test. 
  prove knowledge of the constitution and all out amendments 

Then there needs to be an expensive process of Fees and Taxes as we need to make up for what was stolen from us. They need to be paying up to be here  Freedom ain t free  

I know the countless examples of the thievery  ignorance  violence and free rides we give. 

We are so lax as a nation in ways the world laughs at us . I remember the examples of other countries supporting Trump and Trumps wall  but only in America to we stand in the way of our own freedoms . Liberalism is a disease that the deep state wants to spread to destroy this county  

I ll be the one to say it  crossing our borders is an act of aggression and an act of war and should be treated as such. I ll tell you what  as soon as we start lighting a few up then tmmm   thievery  illegal crossing a",
t3_kn3w76,How the 1619 Project Aims to Change Middle America    If Americans are taught to reject America s founding principles  that leaves room for us to be defined and shaped by an alternative principle  identity politics.,https://www.reddit.com/r/conservatives/comments/kn3w76/how_the_1619_project_aims_to_change_middle/,,
