name,title,url_comments,comments,selftext
t3_ktxjo9,PayPal and Shopify remove Trump related accounts  citing policies against supporting violence,https://www.reddit.com/r/conservatives/comments/ktxjo9/paypal_and_shopify_remove_trumprelated_accounts/,1984 I haven t checked... Have all those BLM shirts been removed  Yet not only did he NOT encourage or incite the violence  he denounced it within an hour of it starting and told his followers to stand down. well here we go No longer using PayPal  And BLM has made 10 Billion and counting... They have no problem with leftists who support violence I bet Neither am I. These fuckers are actually attempting to turn our Country into a Communist State  just like China  Iran and the others  they want to try to disarm us before they go full retard. PayPal   Is he paying off some bets he made   Lmao.  The funniest one was Pinterest.  Showing off his macrame skills.     removed ,
t3_kulisw,UPDATE  DC Officer Sicknick s Death was Driven by Medical Condition   Reports of an Attack Have Not Been Confirmed,https://www.reddit.com/r/conservatives/comments/kulisw/update_dc_officer_sicknicks_death_was_driven_by/, deleted ,
t3_kumytt,Pelosi Tried to Foment a Military Coup Against Trump,https://www.reddit.com/r/conservatives/comments/kumytt/pelosi_tried_to_foment_a_military_coup_against/,Pelosi is scum  removed ,
t3_kum0v3,Android users. These are the 4 steps to avoid phone or app updates. I m not a big techie person but these worked for me.,https://www.reddit.com/r/conservatives/comments/kum0v3/android_users_these_are_the_4_steps_to_avoid/,"Did this  this morning. Figured some bullshit was in the update that popped up today. I would not recommend this strategy. This blocks all updates  including security updates for system level apps. So if you do this you ll have to manually go and check the Play Store for any updates to system apps then manually install them. 

If you re worried about some individual app on your phone updating in a way you don t like  the best option is to just get rid of that app not to disable all app updates.",
t3_ku1roc,Rush  The Swamp Is Scared of the Next 12 Days    They re terrified that Trump is gonna unleash classified documents. You know  he s got a bevy of  em  folks.,https://www.reddit.com/r/conservatives/comments/ku1roc/rush_the_swamp_is_scared_of_the_next_12_days/,I hope he does. I hope he de classifies everything on all of them. Democrats and Republicans alike. I would. I hope he does. Sadly  MSM might just label it as conspiracy theories. For instance  What would he have  They are not scared. They are ecstatic. Can t wait to see the lying Cheetos taxes. He ll do fuck all except cover his own big orange ass. Just like he did for four years. Thats a typical lefty comment...dumb ass,
t3_kul318,Great American Clint Eastwood Marks a Milestone     Dirty Harry  was the first film to push back against the pro criminal Left.,https://www.reddit.com/r/conservatives/comments/kul318/great_american_clint_eastwood_marks_a_milestone/,,
t3_ku242v,Pro Trump supporter  jon dawson on TikTok  removed from their Creator Fund.,https://www.reddit.com/r/conservatives/comments/ku242v/pro_trump_supporter_jon_dawson_on_tiktok_removed/,1984 being a Republican is now a crime That will teach him for having a different opinion. When you can t argue with them because they use facts backed with proof  cancel them.,
t3_kulhrq,Texas Attorney General Vows to Fight Big Tech Censorship with Everything He s Got   Truly Times  ,https://www.reddit.com/r/conservatives/comments/kulhrq/texas_attorney_general_vows_to_fight_big_tech/, Texas Attorney General cancelled in 3.. 2.. 1..  I mean my fb feed is still literally full of whataboutism from both sides. Nothing has changed. How can you be mad they want to stop promoting things that Incite violence. Just a reminder to use DuckDuckGo and protonmail instead of Google gmail The government should come up with a social media platform. Texas wants to fight it  start the process of seceding from the Union. You will have a massive migration of conservatives and a mor autonomy to hold companies accountable. Didn t he try to sue the network for canceling the Kardashian show God bless Texas You knuckleheads are still at it  eh  Fucking pathetic  you lot. Truly. Oh the irony. The same people who fought  against  net neutrality. Many think at least one step ahead next time  lol. Victims of their own stupidity. We don t mind censorship and big tech implementing their own site rules. We mind EQUITABLE censorship.,
t3_kubx4z,Can digital platforms be allowed to stay biased on the grounds that real world systems are biased towards the right ,https://www.reddit.com/r/conservatives/comments/kubx4z/can_digital_platforms_be_allowed_to_stay_biased/,Can t some conservative people or wealthy conservative techies make their own platform and spread it  There was a time before FB and Twitter and Reddit. These all came from nothing and grew to what they are now.,
t3_ktupp6,Leftists Target Clarence Thomas  Call for Resignation After Wife s Alleged Posts on Capitol Protest,https://www.reddit.com/r/conservatives/comments/ktupp6/leftists_target_clarence_thomas_call_for/,Stupid people have stupid pipe dreams We are going to see this more and more. Anyone who has an opposing view is going to be attacked. They are already making lists of trump supporters to persecute.  deleted  Yeah that s not gonna work They are going to impeach and remove him   just watch.,
t3_ku8nbu,Thirteen Charged in Federal Court Following Riot at the United States Capitol,https://www.reddit.com/r/conservatives/comments/ku8nbu/thirteen_charged_in_federal_court_following_riot/,I m sure rich Conservatives will help with bail right  Just like commie Dems ,
t3_ktwrgi,DC Capitol storming  When the refs won t make a call  the gloves come off    For Trump supporters  the last four years were a litany what in hockey is referred to as  no calls. ,https://www.reddit.com/r/conservatives/comments/ktwrgi/dc_capitol_storming_when_the_refs_wont_make_a/,"The better sporting analogy is Soccer.

The referee doesn t call any fouls against the other team that is spending half the game faking injuries and stepping on your shins when the ref s back is turned.  Then the second your team commits a foul  you get a Red Card.",
t3_kuljjr,Dennis Prager   There Is No Example of the Left Having Power and Not Suppressing Speech   Free Speech Is Its Dire Enemy ,https://www.reddit.com/r/conservatives/comments/kuljjr/dennis_prager_there_is_no_example_of_the_left/,,
t3_ktq849,Watch The Capitol Police Open The Doors And Invite Protesters In,https://www.reddit.com/r/conservatives/comments/ktq849/watch_the_capitol_police_open_the_doors_and/,Did I hear one cop say  I disagree with it  but I respect it.   Meanwhile  congress was told to use security tunnels out of safety concerns   https   www.detroitnews.com story news nation 2021 01 04 congress security tunnels election protests 115256474   https   www.detroitnews.com story news nation 2021 01 04 congress security tunnels election protests 115256474   That s because our country s police force is racist. So if you re invited in  is that  insurrection  ,
t3_kuip9i,How To Turn Off iPhone Automatic Software Updates   Keep Parler,https://www.reddit.com/r/conservatives/comments/kuip9i/how_to_turn_off_iphone_automatic_software_updates/,If you re on iOS 13  you can Jailbreak your phone and side load IPA s There was no update pushed by Apple last night. So  The servers are being shut down. There will be no content. And you also open yourself up to security vulnerabilities by doing this. Do u need to do this on Android I review bombed it on Play Store and Apple Store guess I m owning the Right now,
t3_kt9z5s,Nothing but facts  source known ,https://www.reddit.com/r/conservatives/comments/kt9z5s/nothing_but_facts_source_known/,"Definitely don t support either  but if we re making a fuss out of this  we should be making a fuss out of both As a preface  I actively denounce all the riots. They re all wrong. No exceptions. 

That being said  if you encouraged the BLM riots and or defended them in some perverse idea of  racial justice   you have no right to clutch your pearls at the Capitol riot.

EDIT  forgot a word Can you post this on Twatter or Fecalbook  
  
I bet it would be removed before the day is done 

I m going to add to Parler I was on TikTok and some dumbass had an obviously edited video of trump with his family members and Captioned it.. Trump watch party for the Storming the Capitol  . They had some of his family members saying some BS...and anyone with half a brain could see it was heavily edited   But these stupid ass morons in the comments were eating it up    It was so ridiculous    It was like they didn t want to see the truth    How much damage was caused earlier this week  

 100 000  if we re being generous  Compared to the BILLIONS caused by BLM  

I ve also heard the argument  but they killed a cop   

Is David Dorn a joke to you people  I got banned from r moderatepolitics for mentioning some of the things on this list. And the downvotes were serious. It s a joke that they think they re moderate and shows how  like most  they re deluded about the extent of what s been happening in the world. Repost in Politics and they ll probably ban you for revealing truth This is a serious question  what did Trump say that  incited violence  Wednesday   I m searching  but keep coming up with news articles quoting different people  accusing  him of such  but can t find where he actually called for ppl to be violent or act aggressively.

I like your graphic btw  but one person killed Wednesday is 1 too many. It kinda made me squirm to see that listed so laissez faire. This is gas lighting to an extreme. The msm should have 0 credibility and people are still listening to them.  removed  wait so what s the source  There was outrage from the blm riots  just mostly from the right and moderate democrats BLM was mostly outrage over something that s way overblown by the media  the capital protests we re about stopping an overreaching and corrupt government  I do not condone the damage done but the protest was for a reason  and obviously when the government does all it s doing now people are going to get angry and stand up. I knew this was going to happen sooner or later The list is great.  But downplaying the capitol by saying  one federal building  is disingenuous.  I m highly outraged on just that fact alone.  

The dems scream that conservatives are idiots and liars.  We have a duty to show them the truth. Before  i say anything i say that i condemn every violet protests  anything that goes rogue with a certain group going rogue is wrong and should be punished. PERIOD.

BUT BUT BUT 
The catch here is that it is not just any federal building or any state capitol with no one inside. Its full with all the people that the whole United States elected to represent us. Liberal and Conservative. Could you have guaranteed that no elected representative have been hurt if they were there  This is beyond comparison and anything beside rogue seeing a guy with zip tie handcuffs. 

This is wrong and we all need to set a precedent that it can t happen again  whatever party or ideology you represent and support. Comparing and trying to prove isn t going to make it less long. 

IT SHOULDN T HAVE HAPPENED AND CAN T HAPPEN AGAIN Amen This delusional false equivalency is almost adorable in its ignorance Police let individuals upset at the election near congress. Republican and Democrat senators and reps should always be protected from mobs. 

The speaker of house and vice president were one room away from being potentially assassinated. 

That s the big difference for me.      I m a leftwing Liberal who frequently visits this subreddit just out of genuine curiosity.

But I have to agree with this. The hypocrisy is outstanding. I disagree with both acts of violence and rioting. The left have been hypocrites for a long time with how their acting. It s so counter productive to what we re actually meant to be all about  removed  Trump signed an executive order that damaging federal property 20 years minimum. Have fun. But you didn t cite the reason for such riot  More than 1 death so I d wait before spreading it again Encouraged by the president of the United States of America. And if you do the math and add up the numbers from 1 day to 7 month... It s hard to compare with such different time scales. So doing the math to put them on the same scale. 7 months is 213 days. several hours is about 1 3 of a day. So we have 

 amp  x200B 

 BLM Capitol Riot 
       
 Encouraged by killing of innocent civilians. Encouraged by fringe political groups 
 Police force used Police encouraged and joined rioters 
 0.11 people shot per day 3 people shot per day 
 3 officers injured per day 42 officers injured per day 
 0.7 fed buildings damaged per day 3 fed building damaged per day 
 hundreds 213 businesses destroyed per day Attempt to disrupt democracy at best. Terrorism at worst.  Ever watch Vice News  It s the epitome of liberal hypocrisy. They are exactly what this post is pointing out. AND the one at the Capitol was most likely a false flag  Pretty sure smearing your shit on the walls of any Capitol building is a bit different. Of course more were injured  as it lasted 7 months instead of several hours so the sizes of each party is different  not to mention the obvious racial biases in play...
That being said  riots are riots. We shouldn t have any from either party. Sometimes violence gets countered with more violence. I think that BLM is nowhere near as bad as the capitol riot  or at least I don t think that the non violent protests are bad at all. Responding with more violence is bad but if violence is the only language cops understand then... what can they do 

Also  BLM had no outrage  Are you fucking insane  BLM was constantly talked about in all media outlets for months. If you can t see the difference between blm and trying to hunt down the Vice President with Zip tie handcuffs and gallows outside... I can t help you.  

    DISCLAIMER    

I believe that both riots were wrong. My opinion can change on the BLM part  because a lot of those were peaceful  but  addressing the riots 

Both were wrong. The BLM riots were in response to the killing of various unarmed black people  one of which allegedly used a fake  20 bill  if I m remembering that right   and a police officer suffocated George Floyd for that. There were a lot of peaceful protests  but the violent riots were not acceptable and not the right way at all to come to a solution with others concerning the issue at hand. Thing is  even at a lot of the peaceful protests happening in 2020  violent police force was used against people protesting  not talking about the riots there . For the Capital Riot  the rioters got in to the American Capital with relative ease. The police in this case were taking selfies with them and even letting a few pass by. This same police department  along with armed soldiers  cleared out peaceful George Floyd protesters using  tear gas  smoke devices  and excessive force  https   theintercept.com 2020 07 28 dc lafayette square protesters congress hearing  .

Saying there was no outrage to the BLM riots is false  as show  here  https   www.usatoday.com story news factcheck 2020 08 13 fact check democrats have condemned violence linked protests 3317862001  . Obviously  the BLM riots did more damage over 6 to 7 months than one riot did in a day. The difference is that these people attacked and stormed the United States Congress  and attacked our country and our electoral process. They took down the American flag and flew a Trump one. Another person flew the Confederate flag inside the halls of Congress. I am not trying to downplay the BLM riots  but the President said the rioters were   lovely people  and that  he loves them   https   www.cnn.com 2021 01 07 politics trump history comments trnd index.html  before making his apology. While no small businesses were destroyed  I don t need to say the severity of the Capital attacks.

I don t know why I wrote this  but I needed to let out my thoughts. Have a good day fellow internet bros. This is fantastic Donald Trump is a  fringe political group   Also  only one federal building houses all of congress  so I don t get that equivalence. 

How many cops did BLM kill  

Doesn t attacking Congress jeopardize literally every business  

...I have so many questions. blm  trashed some  police stations  targets and burger kings over those 7 months  alongside many peaceful protests  93   

capitol riot  stormed and broke into one of the if not the most important building of the us government  case could be made for an actual coup attempt.

yeah no difference here. watch as covid magically disappears after biden takes office. I think most of the outrage or the main difference that people   Democrats   whoever you want to say that  point out is the reason behind it.

To play devil s advocate on this subreddit  BLM was  was meant to be  started as protests against police brutality  and racial profiling  .
The invasion the other day was an invasion on the Capitol when the new president was going to be appointed by people that GENUINELY think that the election was totally fraudulent and that Trump is the legitimate president. The impressive thing is that  up to millions of Americans might be leas to believe a lie due to ego  selfishness and the greed of those that want to fulfill their agenda.

Feel free to comment and debate on this. I just came to give perspective. Sure BLM did more harm from the participants  whoever they might have been.  removed  You guys probably don t care  but as a supporter of BLM  many if not all  of the supporters of racial equality very much condemned the riots. The protests in many cases were meant to be solely peaceful.

Many  not all  but more than a few  turned into riots either because of unnecessary force from the police while the protests from the police or minor violent altercations between counter protestors and protestors that escalated to a point that the true purpose and goal was lost in the chaos that ensued. 

I personally condemn all of the riots that took place  but it s completely unfair to claim that these events are the same. This was a cult like group of people protesting the certification of the electoral college  a foundation of democracy based on claims from a man who convinced his supporters that the election was rigged before it began. 

Black people just want to be viewed as equal in the eyes of the law.

Black Lives Matter.  deleted  Liberal fucks do not care about facts  truth  respect  religion  or family.. Preach  Well one was about civil issues and police brutality and never brought bombs. The other was trying to take over the government of our democratic nation because they didn t get their way in an election. Oh and there have been bombs brought by these people. So..... The double standard is strong. So some riots are okay  Destruction of property  breaking and entering  thats okay sometimes  But one was to try and make change so that black people stop getting murdered and the other was an attempted coup d etat by followers of a wannabe dictator who have no proof for their conspiracy theories ",
t3_ktqd6q,Liberal Reporter   The New...Authoritarian Liberal left...Is Going to be Absolutely Ruthless ,https://www.reddit.com/r/conservatives/comments/ktqd6q/liberal_reporter_the_newauthoritarian/,"Wow  that is quite a rant. I m very shocked it came from the left. He s exactly right  this is what we are in for and it s terrifying. If this is what they will do before they are even in office... Guess we should come up with a name for these people...

Demsocs 

The new Nazi party  That s a great series of posts he made. Yeh they might even hold corrupt politicians accountable . Watch out GOP    You guys want to be persecuted so bad  it s pathetic.  Y all are gonna be fine.  All trump had to do was not incite a bloodthirsty mob after legitimately losing the election.  Womp womp.",
t3_ktrvc5,Kristi Noem  The Republican Party Has Failed America  And Here s How To Fix It,https://www.reddit.com/r/conservatives/comments/ktrvc5/kristi_noem_the_republican_party_has_failed/,"Fuck both parties at this point  The Democrats don t follow the rules  amp  Republicans follow the rules but don t enforce them. It s not just about saving the party but the US  amp  freedom at this point. This is not a game of political ideologies anymore.  gt  You say yer life s a bum deal

 gt   N yer up against the wall...

 gt  Well  people  you ain t even got no

 gt  Deal at all

 gt   Cause what they do

 gt  In Washington

 gt  They just takes care

 gt  of NUMBER ONE

 gt  An  NUMBER ONE ain t YOU

 gt  You ain t even NUMBER TWO

 gt      The Meek Shall Inherit Nothing  by Frank Zappa",
t3_kttlye,Don t dare call ME a Nazi  Clinched fist senator Josh Hawley lashes out after Joe Biden compares him and Ted Cruz to Goebbels  spreading the  big lie,https://www.reddit.com/r/conservatives/comments/kttlye/dont_dare_call_me_a_nazi_clinchedfist_senator/,Yeah this is rich coming from someone who has been nothing but a fraud and plagiarist his entire career and the only way he can actually get elected was through fraud and stealing of an election by getting executive branches and courts in states to illegally change election laws.  Beijing Biden will never be President  he may occupy the Oval office but he will be know as the unelected fraud for ever. Yet Another Nazi comparison comment that doesn t apply. Cruz used an existing procedure wether people like it or not. What party is supporting all of the banning   I m old enough to remember when a private company had to make cakes for it s customers because not doing so was discrimination.,
t3_kulaxu, These CEOs Who Are Doing This Should Be Prosecuted Criminally    Rep. Devin Nunes Calls for Criminal Charges Against Tech Giants,https://www.reddit.com/r/conservatives/comments/kulaxu/these_ceos_who_are_doing_this_should_be/,I m still waiting for them to actually do anything to Hunter  Hillary  or Louis Lerner  the lady who ran the IRS and negatively targeted conservative s .   I doubt going after these CEO s will happen. Just a reminder to use DuckDuckGo and protonmail instead of Google gmail  removed  If you re an American company that people use to communicate  you must not censor. Free speech. Rep. Devin Nunes calls on criminal charges against tech giants for... operating within their right as private property and business owners  What  A private company is refusing service to people they don t agree with   Shame.  removed ,
t3_ktrvwl,Trump a Twitter rival  After ban  president says he s in talks with other platforms    or may launch his own,https://www.reddit.com/r/conservatives/comments/ktrvwl/trump_a_twitter_rival_after_ban_president_says/,It won t be available at the IPhone or Google Store if he does. Why do people need apps  in some respects they are about lazyiness. And anytime software  apps etc one usually has to agree to let them sell  your data. Just go to various sites old type in address  log in  log off etc. No matter how you cut it  a platform that is not available on iOS or Android and that has very few other users than Trump supporters will really reach no one. I work with digital media for a living. It would be the equivalent to asking Nike to make their own social media platform to match Facebook  Twitter and the rest as a web app. It will never succeed. I m not a Trump supporter btw  but I find this particular subject interesting.,
t3_ktqf7k,Another Top Player in the Conservative Movement Just Dumped Twitter Amid Massive Conservative Purge  RUSH,https://www.reddit.com/r/conservatives/comments/ktqf7k/another_top_player_in_the_conservative_movement/,"all conservatives need to follow.  Make twitter a ghost town.  Leftists hate conservatives  but when no conservatives are around  leftists will turn their hatred on each other and eventually the site will just wither on the vine. Another great Conservative leader. I hate that we now have to brand ourselves as a  conservative  or  conservative movement  it used to just be normal freaking people....

never in my wildest dreams.  If it weren t so damn sad and scary I d almost have to laugh.    


I hope big players continue bailing though. Problem is with any side going to one site is it will become an echo chamber. One of the big problems with the Republicans is many can t debate or counter punch. Same for many Democrats. They just parrot what s on their favorite talking head channel. This is one reason many become so outraged when people don t agree with them. I m surprised either side would want to censor because they re chasing away people they should be trying to convince their opinion is right. Echo chambers become a 24 7 pep rally.

All sides should be using the various platforms and sites to fine tune their side of the argument. Can t a sell a customer anything if  you don t allow them into the store. No one wants to hear the far right or far left crazy bs.",
t3_ku83ol,This looks like and interesting way to talk and try to understand each other.,https://www.reddit.com/r/conservatives/comments/ku83ol/this_looks_like_and_interesting_way_to_talk_and/,Go to the topics section. There s lots of interesting topics to look at. I also like the way it sets up structure  parameters and rules for the conversation.,
