name,title,url_comments
t3_ks5vj5,CBS News Report  Cabinet members discuss invoking 25th Amendment to remove President Trump,https://www.reddit.com/r/democrats/comments/ks5vj5/cbs_news_report_cabinet_members_discuss_invoking/
t3_kse71w,WATCH  Tempers flare in the US House chamber as Republican lawmakers shout over Rep. Conor Lamb  temporarily causing benches to empty  for accusing Republicans of lying about why President Trump lost Pennsylvania.,https://www.reddit.com/r/democrats/comments/kse71w/watch_tempers_flare_in_the_us_house_chamber_as/
t3_krwx67,This was done by trump. This was his doing. He needs to be arrested along with all those f cking brain dead idiots,https://www.reddit.com/r/democrats/comments/krwx67/this_was_done_by_trump_this_was_his_doing_he/
t3_kspyj2,Inside the mind of the Trump mob  The interviews with the rioters,https://www.reddit.com/r/democrats/comments/kspyj2/inside_the_mind_of_the_trump_mob_the_interviews/
t3_kshx8q,What does the American Flag represent to Democrats ,https://www.reddit.com/r/democrats/comments/kshx8q/what_does_the_american_flag_represent_to_democrats/
t3_kryvbw,Let s goooooo,https://www.reddit.com/r/democrats/comments/kryvbw/lets_goooooo/
t3_kryzoa,Hillary Clinton  Today  domestic terrorists attacked a foundation of our democracy  the peaceful transfer of power following free elections. We must reestablish the rule of law and hold them accountable. Democracy is fragile. Our leaders must live up to their responsibility to protect it.,https://www.reddit.com/r/democrats/comments/kryzoa/hillary_clinton_today_domestic_terrorists/
t3_krw9qo,Hmmm... if there was a Trump photo opp  this crowd would have been teargassed and cleared already. Unfortunately  law and order doesn t apply to those storming Capitol Hill.,https://www.reddit.com/r/democrats/comments/krw9qo/hmmm_if_there_was_a_trump_photo_opp_this_crowd/
t3_ks3jxu,You had one job and 700 billion dollars to do it,https://www.reddit.com/r/democrats/comments/ks3jxu/you_had_one_job_and_700_billion_dollars_to_do_it/
t3_krxit3,I couldn t quite remember where I saw the first image...oh that s right.     ,https://www.reddit.com/r/democrats/comments/krxit3/i_couldnt_quite_remember_where_i_saw_the_first/
t3_krwih8,Total Trumpster Fire,https://www.reddit.com/r/democrats/comments/krwih8/total_trumpster_fire/
t3_krx70q,10 Years In Prison,https://www.reddit.com/r/democrats/comments/krx70q/10_years_in_prison/
t3_ks8hb1,The chaos unleashed on the US Capitol by Donald Trump s supporters dominated front pages across the world Thursday  with headlines such as  Trump sets fire to Washington    Democracy under siege   and  The Coup of Madness .,https://www.reddit.com/r/democrats/comments/ks8hb1/the_chaos_unleashed_on_the_us_capitol_by_donald/
t3_ksee5b,Look at Hitler,https://www.reddit.com/r/democrats/comments/ksee5b/look_at_hitler/
t3_ksacv5,Everything is Wrasslin,https://www.reddit.com/r/democrats/comments/ksacv5/everything_is_wrasslin/
t3_ks3e61,Impeach and Convict Trump  Trump Attacks America   ,https://www.reddit.com/r/democrats/comments/ks3e61/impeach_and_convict_trump_trump_attacks_america/
t3_ks3t6r,I m waiting...,https://www.reddit.com/r/democrats/comments/ks3t6r/im_waiting/
t3_ks2wgy,Missouri apologizes.,https://www.reddit.com/r/democrats/comments/ks2wgy/missouri_apologizes/
t3_ksclnn,Trump Acknowledges End Of His Presidency After Congress Certifies Biden s Win,https://www.reddit.com/r/democrats/comments/ksclnn/trump_acknowledges_end_of_his_presidency_after/
t3_krrb9k,When you wanted voter suppression,https://www.reddit.com/r/democrats/comments/krrb9k/when_you_wanted_voter_suppression/
t3_ksdd00,Where you at Brad Pitt ,https://www.reddit.com/r/democrats/comments/ksdd00/where_you_at_brad_pitt/
t3_ks2vo4,Democratic lawmakers call for Pence to invoke 25th Amendment  remove Trump from office,https://www.reddit.com/r/democrats/comments/ks2vo4/democratic_lawmakers_call_for_pence_to_invoke/
t3_krx1r6,If you ever needed to know  over one hour into this  protest    no ploice  this is what WHITE Privilege is. BLM never came close and were gassed and beaten.,https://www.reddit.com/r/democrats/comments/krx1r6/if_you_ever_needed_to_know_over_one_hour_into/
t3_ks0tp0,Well this didn t age well,https://www.reddit.com/r/democrats/comments/ks0tp0/well_this_didnt_age_well/
t3_krxd14,Republican are about  law and order  huh ,https://www.reddit.com/r/democrats/comments/krxd14/republican_are_about_law_and_order_huh/
t3_ks243v,Statement from President Barack Obama about today s event.,https://www.reddit.com/r/democrats/comments/ks243v/statement_from_president_barack_obama_about/
t3_krx7bq,This image makes me sick  I am so glad I changed parties ,https://www.reddit.com/r/democrats/comments/krx7bq/this_image_makes_me_sick_i_am_so_glad_i_changed/
t3_ks1o3k,A tale of 2 Americas  left  today s riot in DC  right  police preparation for a BLM protest,https://www.reddit.com/r/democrats/comments/ks1o3k/a_tale_of_2_americas_left_todays_riot_in_dc_right/
t3_ksgqck,Oct 23  2019   Sky News on Twitter  Donald Trump impeachment  Republicans storm secure hearing room http   news.sky.com story donald trump impeachment republicans storm secure hearing room 11843525,https://www.reddit.com/r/democrats/comments/ksgqck/oct_23_2019_sky_news_on_twitterdonald_trump/
t3_ks4zni,Capitol Hill Protesters were quite the swamp...,https://www.reddit.com/r/democrats/comments/ks4zni/capitol_hill_protesters_were_quite_the_swamp/
t3_ks1zwr,I expected more from you Yukon Cornelius ,https://www.reddit.com/r/democrats/comments/ks1zwr/i_expected_more_from_you_yukon_cornelius/
t3_ks9s6r,Trump says still not over  places hope in Queen,https://www.reddit.com/r/democrats/comments/ks9s6r/trump_says_still_not_over_places_hope_in_queen/
t3_ks25dq,Proving walls don t work to own the libs,https://www.reddit.com/r/democrats/comments/ks25dq/proving_walls_dont_work_to_own_the_libs/
t3_krw9os,Insurrection  this is NOT peaceful protesting.,https://www.reddit.com/r/democrats/comments/krw9os/insurrection_this_is_not_peaceful_protesting/
t3_kskq6b,Top 15 Countries by Total Tax Revenues as Share of GDP   1980 2017,https://www.reddit.com/r/democrats/comments/kskq6b/top_15_countries_by_total_tax_revenues_as_share/
t3_ks0cs3,Darth Trump the Hypocritical,https://www.reddit.com/r/democrats/comments/ks0cs3/darth_trump_the_hypocritical/
t3_krxjyt,These people at our capital right now are embarrassing.,https://www.reddit.com/r/democrats/comments/krxjyt/these_people_at_our_capital_right_now_are/
t3_ksbt7v,Biden to tap Merrick Garland for attorney general,https://www.reddit.com/r/democrats/comments/ksbt7v/biden_to_tap_merrick_garland_for_attorney_general/
t3_krvfzl,There is a coup happening right now in our country.,https://www.reddit.com/r/democrats/comments/krvfzl/there_is_a_coup_happening_right_now_in_our_country/
t3_ksbj4b,Trump Diehards Already Have New Conspiracy Theory For Capitol Siege,https://www.reddit.com/r/democrats/comments/ksbj4b/trump_diehards_already_have_new_conspiracy_theory/
t3_ks4euw,I made this,https://www.reddit.com/r/democrats/comments/ks4euw/i_made_this/
t3_ksf5ag,Fox News Stars  America Had It Coming. Also Antifa Did It. Traitors to the core.,https://www.reddit.com/r/democrats/comments/ksf5ag/fox_news_stars_america_had_it_coming_also_antifa/
t3_ksbd78,House nearly devolves into a brawl during the objection to Pennsylvania electors,https://www.reddit.com/r/democrats/comments/ksbd78/house_nearly_devolves_into_a_brawl_during_the/
t3_krz8yn,No Longer the Party of Lincoln,https://www.reddit.com/r/democrats/comments/krz8yn/no_longer_the_party_of_lincoln/
t3_krwzeb,Law and Order they said... what a joke,https://www.reddit.com/r/democrats/comments/krwzeb/law_and_order_they_said_what_a_joke/
t3_krzosj,So let me get this straight a mob swarms the national capital with half the government leaders inside and only 13 people are arrested....WTF,https://www.reddit.com/r/democrats/comments/krzosj/so_let_me_get_this_straight_a_mob_swarms_the/
t3_ks161u,For your info,https://www.reddit.com/r/democrats/comments/ks161u/for_your_info/
t3_ks3tkh,Can t post on twitter for 12 hours,https://www.reddit.com/r/democrats/comments/ks3tkh/cant_post_on_twitter_for_12_hours/
t3_ks6ibc,Even the normal republicans aren t with the attack on the capitol group.,https://www.reddit.com/r/democrats/comments/ks6ibc/even_the_normal_republicans_arent_with_the_attack/
t3_ksc9nz,Congress Certifies Biden Victory  Trump Pledges  Orderly Transition  On Jan. 20,https://www.reddit.com/r/democrats/comments/ksc9nz/congress_certifies_biden_victory_trump_pledges/
t3_ks04fl,The best cake day present ever,https://www.reddit.com/r/democrats/comments/ks04fl/the_best_cake_day_present_ever/
t3_krvez2,Sore LOSER Piece of  ,https://www.reddit.com/r/democrats/comments/krvez2/sore_loser_piece_of/
t3_ksavgc,A spot of brightness in an otherwise disturbing day,https://www.reddit.com/r/democrats/comments/ksavgc/a_spot_of_brightness_in_an_otherwise_disturbing/
t3_ks2vdm,I AM THE SENATE ,https://www.reddit.com/r/democrats/comments/ks2vdm/i_am_the_senate/
t3_ks5rry,Violence in Washington DC as pro Trump supporters storm US Capitol,https://www.reddit.com/r/democrats/comments/ks5rry/violence_in_washington_dc_as_protrump_supporters/
t3_ks64yc,Trump blocked by Twitter and Facebook,https://www.reddit.com/r/democrats/comments/ks64yc/trump_blocked_by_twitter_and_facebook/
t3_ks40nd,Wise words. Deep meaning.,https://www.reddit.com/r/democrats/comments/ks40nd/wise_words_deep_meaning/
t3_ks3yzj,So r Republican is gone. Says 0 members. Did they lock the sub ,https://www.reddit.com/r/democrats/comments/ks3yzj/so_rrepublican_is_gone_says_0_members_did_they/
t3_ks0bn0,Barely An Inconvenience,https://www.reddit.com/r/democrats/comments/ks0bn0/barely_an_inconvenience/
t3_ks62jq,US Capitol breach prompts host of GOP lawmakers to decide against challenging Biden s win,https://www.reddit.com/r/democrats/comments/ks62jq/us_capitol_breach_prompts_host_of_gop_lawmakers/
t3_krw3fb,No Title Necessary,https://www.reddit.com/r/democrats/comments/krw3fb/no_title_necessary/
t3_ksdyma,Wtf ,https://www.reddit.com/r/democrats/comments/ksdyma/wtf/
t3_ks4nfk,Trumps Deleted Tweet,https://www.reddit.com/r/democrats/comments/ks4nfk/trumps_deleted_tweet/
t3_kru58z,Moscow Mitch  pay back is best served cold ,https://www.reddit.com/r/democrats/comments/kru58z/moscow_mitch_pay_back_is_best_served_cold/
t3_krtjra,Guys I found that QOnion that everyone s talking about.,https://www.reddit.com/r/democrats/comments/krtjra/guys_i_found_that_qonion_that_everyones_talking/
t3_krekys,It s true. I do.,https://www.reddit.com/r/democrats/comments/krekys/its_true_i_do/
t3_ks17ex,  Sen. Josh Hawley  R MO    Sen. Ron Johnson  R WI    Sen. Ted Cruz  R TX    Sen. Kelly Loeffler  R GA    Sen. James Lankford  R OK    Sen. David Perdue  R GA    Sen. Steve Daines  R MT    Sen. John Kennedy  R LA    Sen. Marsha Blackburn  R TN    Sen. Mike Braun  R IN    Sen. Cynthia Lummis  R WY ,https://www.reddit.com/r/democrats/comments/ks17ex/sen_josh_hawley_rmo_sen_ron_johnson_rwi_sen_ted/
t3_ks3spp,Yep,https://www.reddit.com/r/democrats/comments/ks3spp/yep/
t3_krzlgb,Trump Supporters Today,https://www.reddit.com/r/democrats/comments/krzlgb/trump_supporters_today/
t3_ks024t,The Atlantic  Remove Trump Tonight,https://www.reddit.com/r/democrats/comments/ks024t/the_atlantic_remove_trump_tonight/
t3_ks1v9u,This.,https://www.reddit.com/r/democrats/comments/ks1v9u/this/
t3_ks4qq8,Donald J. Trump on Twitter  Anarchists  Agitators or Protestors who vandalize or damage our Federal Courthouse in Portland  or any Federal Buildings in any of our Cities or States  will be prosecuted under our recently re enacted Statues  amp  Monuments Act. MINIMUM TEN YEARS IN PRISON. Don t do it ,https://www.reddit.com/r/democrats/comments/ks4qq8/donald_j_trump_on_twitteranarchists_agitators_or/
t3_krzwg7,Rep. Ilhan Omar on Twitter   I am drawing up articles of impeachment ,https://www.reddit.com/r/democrats/comments/krzwg7/rep_ilhan_omar_on_twitter_i_am_drawing_up/
t3_ks1qt2,Should President Trump be impeached with two weeks left in office  Yes  says IL Gov. Pritzker,https://www.reddit.com/r/democrats/comments/ks1qt2/should_president_trump_be_impeached_with_two/
t3_ks8tlu,Donald Trump is the world s biggest DICKHEAD,https://www.reddit.com/r/democrats/comments/ks8tlu/donald_trump_is_the_worlds_biggest_dickhead/
t3_ksb0i6,Yeah right.,https://www.reddit.com/r/democrats/comments/ksb0i6/yeah_right/
t3_krx2c8,This is what a cult looks like,https://www.reddit.com/r/democrats/comments/krx2c8/this_is_what_a_cult_looks_like/
t3_krxk8a,Republicans in congress your also Responsible for this  your appeased Trump  followed Trump  complicit with Trump  in essence you created this situation.,https://www.reddit.com/r/democrats/comments/krxk8a/republicans_in_congress_your_also_responsible_for/
t3_ksh0wa,Trump has conceded,https://www.reddit.com/r/democrats/comments/ksh0wa/trump_has_conceded/
t3_krsflc,Biden to name judge Merrick Garland as attorney general,https://www.reddit.com/r/democrats/comments/krsflc/biden_to_name_judge_merrick_garland_as_attorney/
t3_ks8ft7,Wow. A serious video,https://www.reddit.com/r/democrats/comments/ks8ft7/wow_a_serious_video/
t3_ks3zjf,This is the first meme I made.,https://www.reddit.com/r/democrats/comments/ks3zjf/this_is_the_first_meme_i_made/
t3_ks7mj6,Can you keep them in the dark for life ,https://www.reddit.com/r/democrats/comments/ks7mj6/can_you_keep_them_in_the_dark_for_life/
t3_krsu21,Spotted in Albany Georgia today       ,https://www.reddit.com/r/democrats/comments/krsu21/spotted_in_albany_georgia_today/
t3_ks4fut,Cops are taking selfies with the terrorists,https://www.reddit.com/r/democrats/comments/ks4fut/cops_are_taking_selfies_with_the_terrorists/
t3_ks2dke,Missouri governor says Trump  absolutely not  to blame for U.S. Capitol violence,https://www.reddit.com/r/democrats/comments/ks2dke/missouri_governor_says_trump_absolutely_not_to/
t3_kryll6,Lolz,https://www.reddit.com/r/democrats/comments/kryll6/lolz/
t3_ks1g54,First lady s chief of staff and former WH press secretary resigns over violent protests,https://www.reddit.com/r/democrats/comments/ks1g54/first_ladys_chief_of_staff_and_former_wh_press/
t3_krrcdi,We did it ,https://www.reddit.com/r/democrats/comments/krrcdi/we_did_it/
t3_kru0wc,Moscow Mitch is now Minority Mitch,https://www.reddit.com/r/democrats/comments/kru0wc/moscow_mitch_is_now_minority_mitch/
t3_ks1q86,For anyone wondering if Trump was involved in the terrorist attacking on the US Capitol.,https://www.reddit.com/r/democrats/comments/ks1q86/for_anyone_wondering_if_trump_was_involved_in_the/
t3_krwvma,Live footage of the Capitol Police watching these armed fucks walk into the House Chambers.,https://www.reddit.com/r/democrats/comments/krwvma/live_footage_of_the_capitol_police_watching_these/
t3_ks35ff,HA ,https://www.reddit.com/r/democrats/comments/ks35ff/ha/
t3_kri85y,URGENT EXTREMELY URGENT  With the margins razor thin  Stacey Abrams has appeared in a new ad urging voters to check that their absentee ballot was counted. Voters have until Friday to fix problems Pass it on. THAT MEANS REPOST. do not just upvote,https://www.reddit.com/r/democrats/comments/kri85y/urgent_extremely_urgent_with_the_margins/
t3_ks6enw,Anyone else notice how Pence is just like Severus Snape ,https://www.reddit.com/r/democrats/comments/ks6enw/anyone_else_notice_how_pence_is_just_like_severus/
t3_krj0je,The south wasn t red  it was suppressed.,https://www.reddit.com/r/democrats/comments/krj0je/the_south_wasnt_red_it_was_suppressed/
t3_ks3gk0,Former SecDef Jim Mattis   Profiles in Cowardice ,https://www.reddit.com/r/democrats/comments/ks3gk0/former_secdef_jim_mattis_profiles_in_cowardice/
t3_krwvyy,I don t want to admit this but....,https://www.reddit.com/r/democrats/comments/krwvyy/i_dont_want_to_admit_this_but/
t3_kryohp,Trump Zombies,https://www.reddit.com/r/democrats/comments/kryohp/trump_zombies/
t3_krycky,Twitter locks Trump s tweets  due to risk of violence ,https://www.reddit.com/r/democrats/comments/krycky/twitter_locks_trumps_tweets_due_to_risk_of/
t3_kry304,Joe Biden became president today... after his speech about the chaos on the Capitol.,https://www.reddit.com/r/democrats/comments/kry304/joe_biden_became_president_today_after_his_speech/
t3_krw91g,Just gonna leave this here.,https://www.reddit.com/r/democrats/comments/krw91g/just_gonna_leave_this_here/
t3_krzb35,SNL  where you at ,https://www.reddit.com/r/democrats/comments/krzb35/snl_where_you_at/
t3_krxlts,r republican has gone into full on safe space mode.,https://www.reddit.com/r/democrats/comments/krxlts/rrepublican_has_gone_into_full_on_safespace_mode/
t3_krzxpr,There must be consequences for those that create conspiracy theories that cause death and distraction.,https://www.reddit.com/r/democrats/comments/krzxpr/there_must_be_consequences_for_those_that_create/
t3_krycvi,Omg the republican subreddit was shut down,https://www.reddit.com/r/democrats/comments/krycvi/omg_the_republican_subreddit_was_shut_down/
t3_ks1rw5,Eek ,https://www.reddit.com/r/democrats/comments/ks1rw5/eek/
t3_krsj0e,WNBA players celebrate Warnock win over Atlanta Dream co owner Loeffler,https://www.reddit.com/r/democrats/comments/krsj0e/wnba_players_celebrate_warnock_win_over_atlanta/
t3_ks0ma1,Because I imagine this will be deleted soon  so here s the documentation. Absolute madness from the Orange Terror.,https://www.reddit.com/r/democrats/comments/ks0ma1/because_i_imagine_this_will_be_deleted_soon_so/
t3_krxqti,Donald Trump ..... Almost Done  ,https://www.reddit.com/r/democrats/comments/krxqti/donald_trump_almost_done/
t3_krx1vw,The end,https://www.reddit.com/r/democrats/comments/krx1vw/the_end/
t3_ks6p20,I just found this random Facebook comment hilariously hypocritical.,https://www.reddit.com/r/democrats/comments/ks6p20/i_just_found_this_random_facebook_comment/
t3_krmu3v,Democrats just won both houses of Congress and the Presidency for the first time in over 10 years.,https://www.reddit.com/r/democrats/comments/krmu3v/democrats_just_won_both_houses_of_congress_and/
t3_kry846,One of the rioters has this flag. I showed this to my grandmother  who was born in Germany just before the start of WWII  And her face fell and she could only shake her head and say   Jesus Christ. ,https://www.reddit.com/r/democrats/comments/kry846/one_of_the_rioters_has_this_flag_i_showed_this_to/
t3_krr1vd,Thank you Georgia ,https://www.reddit.com/r/democrats/comments/krr1vd/thank_you_georgia/
t3_krvrbq,There is a massive lack of security at the capitol and whoever is responsible should be censured.,https://www.reddit.com/r/democrats/comments/krvrbq/there_is_a_massive_lack_of_security_at_the/
t3_krzhzc,Does anyone know where can buy a big   Your Fired   flag in St. Louis ,https://www.reddit.com/r/democrats/comments/krzhzc/does_anyone_know_where_can_buy_a_big_your_fired/
t3_krzypu,Humorous that Fox news still won t call a group of people who break into their own nation s Capitol and shoot someone to death rioters... because it s only a protest until someone loots Target,https://www.reddit.com/r/democrats/comments/krzypu/humorous_that_fox_news_still_wont_call_a_group_of/
t3_ks0gfa,This is out of hand,https://www.reddit.com/r/democrats/comments/ks0gfa/this_is_out_of_hand/
t3_ks2ctb, I know that your powers of retention  are as wet as a warthog s backside. But thick as you are pay attention  My words are a matter of pride. It s clear from your vacant expressions  the lights are not all on upstairs... ,https://www.reddit.com/r/democrats/comments/ks2ctb/i_know_that_your_powers_of_retention_are_as_wet/
t3_ks33nl, Don t believe everything that you breathe You get a parking violation and a maggot on your sleeve So shave your face with some mace in the dark Savin  all your food stamps and burnin  down the trailer park Yo  cut it Soy un perdedor I m a loser baby  so why don t you kill me   Lyrics by Beck,https://www.reddit.com/r/democrats/comments/ks33nl/dont_believe_everything_that_you_breathe_you_get/
t3_ks0sif,I thought you guys would enjoy the reaction to the Capital situation from this person from my hometown. How does this make any sense ,https://www.reddit.com/r/democrats/comments/ks0sif/i_thought_you_guys_would_enjoy_the_reaction_to/
t3_krvj5y,Apparently its cosplay time to go along with the rest of the fantasy,https://www.reddit.com/r/democrats/comments/krvj5y/apparently_its_cosplay_time_to_go_along_with_the/
t3_kryy9s,Time to enforce your own words and laws,https://www.reddit.com/r/democrats/comments/kryy9s/time_to_enforce_your_own_words_and_laws/
t3_krxyz7,We have control of the senate ,https://www.reddit.com/r/democrats/comments/krxyz7/we_have_control_of_the_senate/
t3_krplab,Hillary Clinton  Senate Minority Leader Mitch McConnell.,https://www.reddit.com/r/democrats/comments/krplab/hillary_clinton_senate_minority_leader_mitch/
t3_krywfe,Risk of violence.,https://www.reddit.com/r/democrats/comments/krywfe/risk_of_violence/
t3_kryu8f,One Hell Of A Two Week Notice  Eh Guys ,https://www.reddit.com/r/democrats/comments/kryu8f/one_hell_of_a_twoweek_notice_eh_guys/
t3_krxf8x,Biden condemns riots at Capitol  calls on Trump to demand end to siege,https://www.reddit.com/r/democrats/comments/krxf8x/biden_condemns_riots_at_capitol_calls_on_trump_to/
t3_krsci6,This person needed to replace Tom Perez yesterday,https://www.reddit.com/r/democrats/comments/krsci6/this_person_needed_to_replace_tom_perez_yesterday/
t3_kru94g,Moscow Mitch is now Minority Mitch ,https://www.reddit.com/r/democrats/comments/kru94g/moscow_mitch_is_now_minority_mitch/
t3_kry5p7,What should we call this  The Trump Capitol Hill Insurgency ,https://www.reddit.com/r/democrats/comments/kry5p7/what_should_we_call_this_the_trump_capitol_hill/
t3_krwtv9,Why would the left want to defund the police. Hmmmmmm.,https://www.reddit.com/r/democrats/comments/krwtv9/why_would_the_left_want_to_defund_the_police/
t3_krw1oy, gUeSs iT s piTcHfOrK and TorChes tiMe ,https://www.reddit.com/r/democrats/comments/krw1oy/guess_its_pitchfork_and_torches_time/
t3_ks4fc4,I made this meme,https://www.reddit.com/r/democrats/comments/ks4fc4/i_made_this_meme/
t3_kryzio,The National Association of Manufacturers  NAM  CEO Jay Timmons urged Vice President Mike Pence to  seriously consider  working with President Trump s cabinet to invoke the 25th Amendment in a statement on Wednesday,https://www.reddit.com/r/democrats/comments/kryzio/the_national_association_of_manufacturers_nam_ceo/
t3_krxrvd,Democrats have 2 years to get as much done as possible that positively impacts as many people as quick as possible or that s it for America.,https://www.reddit.com/r/democrats/comments/krxrvd/democrats_have_2_years_to_get_as_much_done_as/
t3_krzxh0,With historic wins  Democrats seize US Senate control,https://www.reddit.com/r/democrats/comments/krzxh0/with_historic_wins_democrats_seize_us_senate/
t3_krzqb2,Wait WHAT  Lawmakers are refusing to wear masks while in isolation with hundreds of people in small room of The US Capital ,https://www.reddit.com/r/democrats/comments/krzqb2/wait_what_lawmakers_are_refusing_to_wear_masks/
t3_krxzve, Hitler was right on one thing   Republican US congresswoman says at pro Trump rally,https://www.reddit.com/r/democrats/comments/krxzve/hitler_was_right_on_one_thing_republican_us/
t3_krwzr9,Remember today. It is the defining moment of truth for many US factions,https://www.reddit.com/r/democrats/comments/krwzr9/remember_today_it_is_the_defining_moment_of_truth/
t3_krxcq6, Democracy is fragile and to preserve it requires people of good will and leaders who are not afraid to stand up ,https://www.reddit.com/r/democrats/comments/krxcq6/democracy_is_fragile_and_to_preserve_it_requires/
t3_krqd4b,Mitch McConnel is going to be so confused. He s never had to represent minorities before.,https://www.reddit.com/r/democrats/comments/krqd4b/mitch_mcconnel_is_going_to_be_so_confused_hes/
t3_krxqs4,Did trump incite a riot today ,https://www.reddit.com/r/democrats/comments/krxqs4/did_trump_incite_a_riot_today/
t3_krv6lb,Capitol is on lockdown as pro Trump demonstrators try to break into the building,https://www.reddit.com/r/democrats/comments/krv6lb/capitol_is_on_lockdown_as_protrump_demonstrators/
t3_kro71d,Hello there,https://www.reddit.com/r/democrats/comments/kro71d/hello_there/
t3_krqpbg,Bye Felicia,https://www.reddit.com/r/democrats/comments/krqpbg/bye_felicia/
t3_krxnsq,What would be happening if Black Citizens had stormed The Peoples House ,https://www.reddit.com/r/democrats/comments/krxnsq/what_would_be_happening_if_black_citizens_had/
t3_krrjfy,Column  Ted Cruz and Josh Hawley are torching the Constitution to further their own presidential ambitions,https://www.reddit.com/r/democrats/comments/krrjfy/column_ted_cruz_and_josh_hawley_are_torching_the/
t3_ks0d4b,Small self post  it s important to realize that this coup attempt is proof of concept for proud boys and girls.,https://www.reddit.com/r/democrats/comments/ks0d4b/small_self_post_its_important_to_realize_that/
t3_kqyfh6,I voted today in probably the most important election of my lifetime.,https://www.reddit.com/r/democrats/comments/kqyfh6/i_voted_today_in_probably_the_most_important/
t3_kry064,Latest on Capitol Hill  Explosive device found  mob roams building,https://www.reddit.com/r/democrats/comments/kry064/latest_on_capitol_hill_explosive_device_found_mob/
t3_krv1kr,Trump supporters trying to break police lines at the capital building,https://www.reddit.com/r/democrats/comments/krv1kr/trump_supporters_trying_to_break_police_lines_at/
t3_krwgrn,Lmao  they really defend protesters storming the US Capital,https://www.reddit.com/r/democrats/comments/krwgrn/lmao_they_really_defend_protesters_storming_the/
t3_krgj87,Kelly Loeffler looking at election results.,https://www.reddit.com/r/democrats/comments/krgj87/kelly_loeffler_looking_at_election_results/
