name,title,url_comments
t3_kswgl5,if you have republican senators contact them at https   senate.gov  and tell them to support the impeachment of trump. 17 republican senators are needed for impeachment. Picture below is a placeholder,https://www.reddit.com/r/democrats/comments/kswgl5/if_you_have_republican_senators_contact_them_at/
t3_ksuh9q,What kind of leader kills his people ,https://www.reddit.com/r/democrats/comments/ksuh9q/what_kind_of_leader_kills_his_people/
t3_kszuh8,Michael Cohen  I Am Certain That Donald Trump Is Psychotic Right Now,https://www.reddit.com/r/democrats/comments/kszuh8/michael_cohen_i_am_certain_that_donald_trump_is/
t3_kshb3u,Equality under the law.,https://www.reddit.com/r/democrats/comments/kshb3u/equality_under_the_law/
t3_ksv1aq,Ding  dong  the witch is gone,https://www.reddit.com/r/democrats/comments/ksv1aq/ding_dong_the_witch_is_gone/
t3_ksxvyq,The argument for why r Conservative doesn t have or need anything to mark shit posts,https://www.reddit.com/r/democrats/comments/ksxvyq/the_argument_for_why_rconservative_doesnt_have_or/
t3_ksrszr,Hold the GOP Accountable for the Coup Attempt,https://www.reddit.com/r/democrats/comments/ksrszr/hold_the_gop_accountable_for_the_coup_attempt/
t3_ksquh1,If Missouri Sen. Josh Hawley had a conscience  he d resign. He ll have to be removed,https://www.reddit.com/r/democrats/comments/ksquh1/if_missouri_sen_josh_hawley_had_a_conscience_hed/
t3_ksff29,Seems to me that the Republican Party just committed political suicide.,https://www.reddit.com/r/democrats/comments/ksff29/seems_to_me_that_the_republican_party_just/
t3_ksnvly,We don t have a militia. They are a domestic terrorisms organization,https://www.reddit.com/r/democrats/comments/ksnvly/we_dont_have_a_militia_they_are_a_domestic/
t3_ksxrzf,A Trumper left this comment in response to Trump s recent video Tweet. So satsifying ,https://www.reddit.com/r/democrats/comments/ksxrzf/a_trumper_left_this_comment_in_response_to_trumps/
t3_ksr58z,An open letter to Evangelicals for Trump   You failed America by not denouncing Trump in the past. You need to denounce him now.,https://www.reddit.com/r/democrats/comments/ksr58z/an_open_letter_to_evangelicals_for_trump_you/
t3_ksv7p3,Another reason why we NEED DC statehood,https://www.reddit.com/r/democrats/comments/ksv7p3/another_reason_why_we_need_dc_statehood/
t3_ksubwc,Internet exposes rioters who stormed congress after police let them go,https://www.reddit.com/r/democrats/comments/ksubwc/internet_exposes_rioters_who_stormed_congress/
t3_kstq3b,TRE45ON.,https://www.reddit.com/r/democrats/comments/kstq3b/tre45on/
t3_kt28wr,After the last two days this singlehandedly lightened up my stress.,https://www.reddit.com/r/democrats/comments/kt28wr/after_the_last_two_days_this_singlehandedly/
t3_kt2249,Dream a little dream.,https://www.reddit.com/r/democrats/comments/kt2249/dream_a_little_dream/
t3_kt8iwz,U.S. COVID 19 Deaths by State   Evolution from March  20 to January  21,https://www.reddit.com/r/democrats/comments/kt8iwz/us_covid19_deaths_by_state_evolution_from_march/
t3_ksz9ms,I ll just leave this here...,https://www.reddit.com/r/democrats/comments/ksz9ms/ill_just_leave_this_here/
t3_ksve73,Apparently trump supporters feel persecuted.  Fixed for rules ,https://www.reddit.com/r/democrats/comments/ksve73/apparently_trump_supporters_feel_persecuted_fixed/
t3_krxwmh,I guess this aged like milk.,https://www.reddit.com/r/democrats/comments/krxwmh/i_guess_this_aged_like_milk/
t3_kspwyn,When the Georgia runoff goes double Democrat,https://www.reddit.com/r/democrats/comments/kspwyn/when_the_georgia_runoff_goes_double_democrat/
t3_ksgzy1,Schumer Statement Calling for the President to Be Immediately Removed from Office,https://www.reddit.com/r/democrats/comments/ksgzy1/schumer_statement_calling_for_the_president_to_be/
t3_ksmshh,The party of flaw and disorder,https://www.reddit.com/r/democrats/comments/ksmshh/the_party_of_flaw_and_disorder/
t3_kt2f0l,Beer Hall Putsch,https://www.reddit.com/r/democrats/comments/kt2f0l/beer_hall_putsch/
t3_kstsb8,Robert de Niro s  Fuck Trump  speech at Tony awards,https://www.reddit.com/r/democrats/comments/kstsb8/robert_de_niros_fuck_trump_speech_at_tony_awards/
t3_ksknxf,The Latest  Pelosi calls for using 25th Amendment on Trump,https://www.reddit.com/r/democrats/comments/ksknxf/the_latest_pelosi_calls_for_using_25th_amendment/
t3_kswr7r,We said we needed a revolution,https://www.reddit.com/r/democrats/comments/kswr7r/we_said_we_needed_a_revolution/
t3_ksm773,The White House today,https://www.reddit.com/r/democrats/comments/ksm773/the_white_house_today/
t3_kso6z2,Lincoln is turning in his grave ,https://www.reddit.com/r/democrats/comments/kso6z2/lincoln_is_turning_in_his_grave/
t3_ks69lz,Domestic Terrorists,https://www.reddit.com/r/democrats/comments/ks69lz/domestic_terrorists/
t3_ksklul,Texas Democrats call for Sen. Ted Cruz s resignation for  acting in bad faith    ,https://www.reddit.com/r/democrats/comments/ksklul/texas_democrats_call_for_sen_ted_cruzs/
t3_kst3sy,Sen. Elizabeth Warren  Trump is a  Lying Coward    NowThis,https://www.reddit.com/r/democrats/comments/kst3sy/sen_elizabeth_warren_trump_is_a_lying_coward/
t3_ksp1uz,It was g o ing to be c ome the biggest con...,https://www.reddit.com/r/democrats/comments/ksp1uz/it_was_going_to_become_the_biggest_con/
t3_ksnri0,Trump s remarks before Capitol riot may be investigated  acting D.C. U.S. attorney says,https://www.reddit.com/r/democrats/comments/ksnri0/trumps_remarks_before_capitol_riot_may_be/
t3_ksm8r9,This sums up yesterday s events,https://www.reddit.com/r/democrats/comments/ksm8r9/this_sums_up_yesterdays_events/
t3_ksqapw,President Elect Biden Calls Out Domestic Terrorists  amp  Trump   NowThis,https://www.reddit.com/r/democrats/comments/ksqapw/presidentelect_biden_calls_out_domestic/
t3_kslgj3,Biden Calls Out Racist Double Standard In Response To Capitol Riot,https://www.reddit.com/r/democrats/comments/kslgj3/biden_calls_out_racist_double_standard_in/
t3_kssbq5,Trump conceded but it was more forced than the shy kid in junior high who didn t want to present his book report to the class.,https://www.reddit.com/r/democrats/comments/kssbq5/trump_conceded_but_it_was_more_forced_than_the/
t3_ksvdfc,Ted Cruz revises remarks after storming of US Capitol,https://www.reddit.com/r/democrats/comments/ksvdfc/ted_cruz_revises_remarks_after_storming_of_us/
t3_ksiw0v,The Photos of These Women Saving the Ballot Boxes Belong in History Books   ,https://www.reddit.com/r/democrats/comments/ksiw0v/the_photos_of_these_women_saving_the_ballot_boxes/
t3_ksnbjg,It s happening ,https://www.reddit.com/r/democrats/comments/ksnbjg/its_happening/
t3_ksvzek,Places that are harder to get into than the Capitol building,https://www.reddit.com/r/democrats/comments/ksvzek/places_that_are_harder_to_get_into_than_the/
t3_ksk890, Slow it down   Giuliani asked GOP senator to object to electoral votes from 10 states. Voicemail was then leaked after being sent to the wrong number.,https://www.reddit.com/r/democrats/comments/ksk890/slow_it_down_giuliani_asked_gop_senator_to_object/
t3_ksq9k1,US Capitol Police officer has died following pro Trump riot,https://www.reddit.com/r/democrats/comments/ksq9k1/us_capitol_police_officer_has_died_following/
t3_ksncy7,Everyone needs to see this,https://www.reddit.com/r/democrats/comments/ksncy7/everyone_needs_to_see_this/
t3_kskp12,Official describes the president as a  total monster  who refused to act as Congress was stormed,https://www.reddit.com/r/democrats/comments/kskp12/official_describes_the_president_as_a_total/
t3_kshz15,Joe Scarborough Gets PISSED and Drops F Bomb LIVE on MSNBC s Morning Joe,https://www.reddit.com/r/democrats/comments/kshz15/joe_scarborough_gets_pissed_and_drops_fbomb_live/
t3_ksuj8o,For all the Breath of the Wild fans out there.,https://www.reddit.com/r/democrats/comments/ksuj8o/for_all_the_breath_of_the_wild_fans_out_there/
t3_ksr0un,Trump s new book on how he survived 4 years in the whitehouse. Coming to a bookstore near you ,https://www.reddit.com/r/democrats/comments/ksr0un/trumps_new_book_on_how_he_survived_4_years_in_the/
t3_ksxsht,Too tired to make a joke,https://www.reddit.com/r/democrats/comments/ksxsht/too_tired_to_make_a_joke/
t3_ksrdaz,Looks like someone finally conceded ,https://www.reddit.com/r/democrats/comments/ksrdaz/looks_like_someone_finally_conceded/
t3_ks28oo,Chuck Schumer said it right.,https://www.reddit.com/r/democrats/comments/ks28oo/chuck_schumer_said_it_right/
t3_ksnp6e,WE ALL SEE THE DIFFEERENCE ,https://www.reddit.com/r/democrats/comments/ksnp6e/we_all_see_the_diffeerence/
t3_ksmfx6,Um  Are they deplorable yet. Because the basket is pretty full.,https://www.reddit.com/r/democrats/comments/ksmfx6/um_are_they_deplorable_yet_because_the_basket_is/
t3_ksqz2e,I m European but this is ridiculous,https://www.reddit.com/r/democrats/comments/ksqz2e/im_european_but_this_is_ridiculous/
t3_ksqyk6,my 2019 artistic prediction...  ,https://www.reddit.com/r/democrats/comments/ksqyk6/my_2019_artistic_prediction/
t3_ksuqfd,They are taking this very well.,https://www.reddit.com/r/democrats/comments/ksuqfd/they_are_taking_this_very_well/
t3_ksjb8r, End this nightmare   Lawmakers push to invoke 25th Amendment to remove Trump,https://www.reddit.com/r/democrats/comments/ksjb8r/end_this_nightmare_lawmakers_push_to_invoke_25th/
t3_ksijfc,I hope yesterday was a great awakening for Republicans.,https://www.reddit.com/r/democrats/comments/ksijfc/i_hope_yesterday_was_a_great_awakening_for/
t3_kspm5w,Wrote a letter to Rep. Kinzinger a Republican of Illinois. He has never been afraid of calling trump out on his shit. Also  thought the font was a nice touch.,https://www.reddit.com/r/democrats/comments/kspm5w/wrote_a_letter_to_rep_kinzinger_a_republican_of/
t3_ksnxwi,F    the Seditious 7 Senators and F    their donors too  If you can afford to boycott these business  please do. These senators may believe their actions have no consequences  but I think we should show them that is true https   docs.google.com spreadsheets d 14RbS9pMUH3DJ3nekukCE5lZY0AaOUwW4cnFWaxY,https://www.reddit.com/r/democrats/comments/ksnxwi/f_the_seditious_7_senators_and_f_their_donors_too/
t3_ks55ds,WHAT THE FUCK IS THIS    After today s coup attempt. 100  Republicans  STILL  voted to end democracy. THEY ARE ALL TRAITORS ,https://www.reddit.com/r/democrats/comments/ks55ds/what_the_fuck_is_this_after_todays_coup_attempt/
t3_kslgee,Rep. Matt Gaetz falsely claims facial recognition found antifa at Capitol riot,https://www.reddit.com/r/democrats/comments/kslgee/rep_matt_gaetz_falsely_claims_facial_recognition/
t3_ksp6f0,Made this video to remember yesterdays events   The Insurrection at Capitol Hill,https://www.reddit.com/r/democrats/comments/ksp6f0/made_this_video_to_remember_yesterdays_events_the/
t3_kssqhr,Trump concedes and accepts the election results. Will support a smooth Biden transition.,https://www.reddit.com/r/democrats/comments/kssqhr/trump_concedes_and_accepts_the_election_results/
t3_kte525,We need to stop being so biased and hypocritical.,https://www.reddit.com/r/democrats/comments/kte525/we_need_to_stop_being_so_biased_and_hypocritical/
t3_ksm30a,Impeach Trump Now,https://www.reddit.com/r/democrats/comments/ksm30a/impeach_trump_now/
t3_ksjlgr,America is more divided and less great than it was 4 years ago. What do you think ,https://www.reddit.com/r/democrats/comments/ksjlgr/america_is_more_divided_and_less_great_than_it/
t3_ksm7k8,West Virginia lawmaker who recorded himself storming Capitol urged to resign in petition,https://www.reddit.com/r/democrats/comments/ksm7k8/west_virginia_lawmaker_who_recorded_himself/
t3_kst5e3,Speaker Pelosi Calls on VP Pence to Invoke 25th Amendment   NowThis,https://www.reddit.com/r/democrats/comments/kst5e3/speaker_pelosi_calls_on_vp_pence_to_invoke_25th/
t3_ks9fne,U.S. Congress accepts Electoral College result  clears way for Biden to become president,https://www.reddit.com/r/democrats/comments/ks9fne/us_congress_accepts_electoral_college_result/
t3_ksnetu,Is America great yet ,https://www.reddit.com/r/democrats/comments/ksnetu/is_america_great_yet/
t3_ksqpvb,FBI   FBI Seeking Information Related to Violent Activity at the U.S Capitol Building,https://www.reddit.com/r/democrats/comments/ksqpvb/fbi_fbi_seeking_information_related_to_violent/
t3_ksisl3,Fake History,https://www.reddit.com/r/democrats/comments/ksisl3/fake_history/
t3_kspmwx,Nothing to hide from,https://www.reddit.com/r/democrats/comments/kspmwx/nothing_to_hide_from/
t3_ksl590,If anyone has videos pictures material of people committing illegal activity at the Capitol please submit it to the FBI here.,https://www.reddit.com/r/democrats/comments/ksl590/if_anyone_has_videospicturesmaterial_of_people/
t3_ksr6yb,Looks like they were short on time and spray paint before trumps press conference,https://www.reddit.com/r/democrats/comments/ksr6yb/looks_like_they_were_short_on_time_and_spray/
t3_ks28sn,Spend billions it will work,https://www.reddit.com/r/democrats/comments/ks28sn/spend_billions_it_will_work/
t3_ks1o1d,This   ,https://www.reddit.com/r/democrats/comments/ks1o1d/this/
t3_ksojcn,Working on protoype glasses for collecting republican tears.,https://www.reddit.com/r/democrats/comments/ksojcn/working_on_protoype_glasses_for_collecting/
t3_kskhrg, Great ,https://www.reddit.com/r/democrats/comments/kskhrg/great/
t3_ksl9rn,Kyle Griffin on Twitter  Punchbowl News  House lawmaker   There s a severe covid outbreak coming among members. At the secure location yesterday at least 50 GOP members refused to wear masks. They were asked repeatedly. Older dem members pleaded. And they wouldn t do it. ,https://www.reddit.com/r/democrats/comments/ksl9rn/kyle_griffin_on_twitter_punchbowl_news_house/
t3_ksqvuk,Pence is said to oppose invoking 25th Amendment to strip Trump of his duties.,https://www.reddit.com/r/democrats/comments/ksqvuk/pence_is_said_to_oppose_invoking_25th_amendment/
t3_ksm40d,Thought you guys would appreciate this  especially after yesterday and the current delusions,https://www.reddit.com/r/democrats/comments/ksm40d/thought_you_guys_would_appreciate_this_especially/
t3_kski82,Pelosi says house dems  may  be prepared to move forward with impeachment,https://www.reddit.com/r/democrats/comments/kski82/pelosi_says_house_dems_may_be_prepared_to_move/
t3_ksndo9,Are memes allowed ,https://www.reddit.com/r/democrats/comments/ksndo9/are_memes_allowed/
t3_kselyu,He s going to stand by what he said right  The law doesn t change bc it was his supporters doing the damage correct  Phucking hypocrites  ,https://www.reddit.com/r/democrats/comments/kselyu/hes_going_to_stand_by_what_he_said_right_the_law/
t3_ks2m4u,Republicans did this as a party.,https://www.reddit.com/r/democrats/comments/ks2m4u/republicans_did_this_as_a_party/
t3_kskx5b,Neal Katyal on Twitter  So  msnbc has just reported that Speaker Pelosi has told Pence  invoke 25th Amendment or we will take up impeachment. Exactly right.,https://www.reddit.com/r/democrats/comments/kskx5b/neal_katyal_on_twitter_so_msnbc_has_just_reported/
t3_ksqmts,Trump s End,https://www.reddit.com/r/democrats/comments/ksqmts/trumps_end/
t3_ksq71a,Remember the plot of National Treasure 2 ,https://www.reddit.com/r/democrats/comments/ksq71a/remember_the_plot_of_national_treasure_2/
t3_kskqxd,Irony at it s finest,https://www.reddit.com/r/democrats/comments/kskqxd/irony_at_its_finest/
t3_ksc8yj,I don t completely blame trump for the coup attempt. He is a game show host with a very low IQ. I blame the RNC for ever letting it get this far. If you give a toddler a loader pistol in a crowded room someone is going to get shot. The RNC is the real bad guy and all that enabled this failed man,https://www.reddit.com/r/democrats/comments/ksc8yj/i_dont_completely_blame_trump_for_the_coup/
t3_ksfy6d,Two Americas,https://www.reddit.com/r/democrats/comments/ksfy6d/two_americas/
t3_ksepsa,Wonder if he used his PPP loan money to help fund his act of sedition and theft in Nancy Pelosi s office          ,https://www.reddit.com/r/democrats/comments/ksepsa/wonder_if_he_used_his_ppp_loan_money_to_help_fund/
t3_ksl4ra,Pelosi calls to invoke 25th Amendment or says impeachment effort may be carried out,https://www.reddit.com/r/democrats/comments/ksl4ra/pelosi_calls_to_invoke_25th_amendment_or_says/
t3_ksxwg0,We really gotta work on being more inclusive.,https://www.reddit.com/r/democrats/comments/ksxwg0/we_really_gotta_work_on_being_more_inclusive/
t3_ksgx2p,Facebook bans Trump  indefinitely ,https://www.reddit.com/r/democrats/comments/ksgx2p/facebook_bans_trump_indefinitely/
t3_krxlw4,JOHN OSSOFF WINS  FIRST JEWISH SENATOR IN GEORGIA HISTORY  DEMOCRATS WIN THE U.S. SENATE VIA DECIDING 50 50 VP HARRIS VOTE ,https://www.reddit.com/r/democrats/comments/krxlw4/john_ossoff_wins_first_jewish_senator_in_georgia/
t3_ksljez,Facebook blocks Trump  at least until transition complete ,https://www.reddit.com/r/democrats/comments/ksljez/facebook_blocks_trump_at_least_until_transition/
t3_ks8jen,We Must Impeach Donald Trump Again. And His Seditious Congressional Allies Must Be Removed,https://www.reddit.com/r/democrats/comments/ks8jen/we_must_impeach_donald_trump_again_and_his/
t3_ks3whn,Protestors vs Terrorists,https://www.reddit.com/r/democrats/comments/ks3whn/protestors_vs_terrorists/
t3_ksfazj, Unacceptable    Probe Demanded After Footage Shows Capitol Police Standing Aside for Pro Trump Mob  and taking selfie s inside the capital,https://www.reddit.com/r/democrats/comments/ksfazj/unacceptable_probe_demanded_after_footage_shows/
t3_ks6wki,Treason,https://www.reddit.com/r/democrats/comments/ks6wki/treason/
t3_ks57k7,What a shit show today was for America.,https://www.reddit.com/r/democrats/comments/ks57k7/what_a_shit_show_today_was_for_america/
t3_kslruh,How would I get Speaker Pelosi to sign a picture   I collect political memorabilia of the people I like ,https://www.reddit.com/r/democrats/comments/kslruh/how_would_i_get_speaker_pelosi_to_sign_a_picture/
t3_ksh0uc,   Congrats to Georgia s two new Democratic senators. We finally ditched Mitch and turned Georgia blue ,https://www.reddit.com/r/democrats/comments/ksh0uc/congrats_to_georgias_two_new_democratic_senators/
t3_kswwoc,Meanwhile in the US Capitol Hill,https://www.reddit.com/r/democrats/comments/kswwoc/meanwhile_in_the_us_capitol_hill/
t3_ks7xpc,Timeline  Never Again,https://www.reddit.com/r/democrats/comments/ks7xpc/timeline_never_again/
t3_ksd97b,Remove Trump Tonight,https://www.reddit.com/r/democrats/comments/ksd97b/remove_trump_tonight/
t3_ksd8ga,Joe Biden breaks record after winning the U.S. Presidency for the fifth time.,https://www.reddit.com/r/democrats/comments/ksd8ga/joe_biden_breaks_record_after_winning_the_us/
t3_ksqmt6,US Republicans condemn Trump s role in Capitol insurrection,https://www.reddit.com/r/democrats/comments/ksqmt6/us_republicans_condemn_trumps_role_in_capitol/
t3_ksi0uv,The 147 Republicans Who Voted To Overturn Election Results,https://www.reddit.com/r/democrats/comments/ksi0uv/the_147_republicans_who_voted_to_overturn/
t3_ksfome,Walls...lol,https://www.reddit.com/r/democrats/comments/ksfome/wallslol/
t3_ksqbp9,Pence better not Pardon Trump ,https://www.reddit.com/r/democrats/comments/ksqbp9/pence_better_not_pardon_trump/
t3_ksq7ha,Trump Treason,https://www.reddit.com/r/democrats/comments/ksq7ha/trump_treason/
t3_ks7l6s,The president and those who entered the Senate chambers today should be charged with Sedition.,https://www.reddit.com/r/democrats/comments/ks7l6s/the_president_and_those_who_entered_the_senate/
t3_ksjyeq,Obama calls violence at U.S. Capitol a moment of shame  says it was  incited by a sitting president ,https://www.reddit.com/r/democrats/comments/ksjyeq/obama_calls_violence_at_us_capitol_a_moment_of/
t3_ksh0ka,Sen. Mitt Romney   What happened here today was an insurrection. ,https://www.reddit.com/r/democrats/comments/ksh0ka/sen_mitt_romney_what_happened_here_today_was_an/
t3_ks7771,I miss him so much...,https://www.reddit.com/r/democrats/comments/ks7771/i_miss_him_so_much/
t3_ksls77,The best thing to happen yesterday imo,https://www.reddit.com/r/democrats/comments/ksls77/the_best_thing_to_happen_yesterday_imo/
t3_kskcax,When the lights turn off...,https://www.reddit.com/r/democrats/comments/kskcax/when_the_lights_turn_off/
t3_ksize3,House committee opens investigation into Capitol mob breach...,https://www.reddit.com/r/democrats/comments/ksize3/house_committee_opens_investigation_into_capitol/
t3_ksghkg,You can t spell it without it,https://www.reddit.com/r/democrats/comments/ksghkg/you_cant_spell_it_without_it/
t3_krvwc0,Using Trumps own words   When the looting starts the shooting starts  Our liberty is being stolen by Trump and his MAGAtards,https://www.reddit.com/r/democrats/comments/krvwc0/using_trumps_own_words_when_the_looting_starts/
t3_ksb62b,What going on r republicans looks like now,https://www.reddit.com/r/democrats/comments/ksb62b/what_going_on_rrepublicans_looks_like_now/
t3_ksr2bp,R,https://www.reddit.com/r/democrats/comments/ksr2bp/r/
t3_ks8pjz,And the white privilege award goes to...,https://www.reddit.com/r/democrats/comments/ks8pjz/and_the_white_privilege_award_goes_to/
t3_ksfx5d, CAMP AUSCHWITZ     Trump s Vassals committing treason.,https://www.reddit.com/r/democrats/comments/ksfx5d/camp_auschwitz_trumps_vassals_committing_treason/
t3_krzmjz,Watching these terrorists being treated with kid gloves.,https://www.reddit.com/r/democrats/comments/krzmjz/watching_these_terrorists_being_treated_with_kid/
t3_ks99ew,It s official. Joe Biden and Kamala Harris are president and vice president of the United States of America  ,https://www.reddit.com/r/democrats/comments/ks99ew/its_official_joe_biden_and_kamala_harris_are/
t3_krh541,THE REAL MVP,https://www.reddit.com/r/democrats/comments/krh541/the_real_mvp/
t3_krykox,Trump supporters won t admit they lost,https://www.reddit.com/r/democrats/comments/krykox/trump_supporters_wont_admit_they_lost/
t3_ksj9nm,Most googled terms today,https://www.reddit.com/r/democrats/comments/ksj9nm/most_googled_terms_today/
t3_ksfrr3,This is a true story just heard it myself and I m shocked. Was getting fuel. Overheard 2  gentlemen  talking. Evidently when trump told everyone to go home they did immediately. Then  antiqua  went into the capital and destroyed it. The koolaid runs deep and thick and it s a bit cloudy apparently.,https://www.reddit.com/r/democrats/comments/ksfrr3/this_is_a_true_story_just_heard_it_myself_and_im/
t3_kstfyo,First time I ve been able to agree with a Trumper... I don t believe a single word he said.,https://www.reddit.com/r/democrats/comments/kstfyo/first_time_ive_been_able_to_agree_with_a_trumper/
t3_kses3g,Everyone right now,https://www.reddit.com/r/democrats/comments/kses3g/everyone_right_now/
t3_ksgcft,Jimmy Kimmel on Angry Trump Mob Storming the Capitol,https://www.reddit.com/r/democrats/comments/ksgcft/jimmy_kimmel_on_angry_trump_mob_storming_the/
t3_ksjzw4,Elaine Chao to resign as transportation secretary in wake of riot,https://www.reddit.com/r/democrats/comments/ksjzw4/elaine_chao_to_resign_as_transportation_secretary/
t3_ksm2e6,It s time for America to check into rehab,https://www.reddit.com/r/democrats/comments/ksm2e6/its_time_for_america_to_check_into_rehab/
t3_ks2p58,     ,https://www.reddit.com/r/democrats/comments/ks2p58/_/
t3_ksguay,Senator Cory Booker   We Shall Overcome ,https://www.reddit.com/r/democrats/comments/ksguay/senator_cory_booker_we_shall_overcome/
t3_ks9etb,BIDEN HARRIS certified by Congress for Inauguration on 01 20,https://www.reddit.com/r/democrats/comments/ks9etb/bidenharris_certified_by_congress_for/
t3_kssg2b,Council of DC on Twitter,https://www.reddit.com/r/democrats/comments/kssg2b/council_of_dc_on_twitter/
t3_ks5934,Our bad.   ,https://www.reddit.com/r/democrats/comments/ks5934/our_bad/
t3_ks3uml,America  You ll never walk alone ,https://www.reddit.com/r/democrats/comments/ks3uml/america_youll_never_walk_alone/
t3_ksfpi4,The World is Laughing at Us.,https://www.reddit.com/r/democrats/comments/ksfpi4/the_world_is_laughing_at_us/
t3_ks4x2y,These six GOP senators voted to sustain the objection against Arizona s electoral votes,https://www.reddit.com/r/democrats/comments/ks4x2y/these_six_gop_senators_voted_to_sustain_the/
t3_ks6748,Thought of a cute band name,https://www.reddit.com/r/democrats/comments/ks6748/thought_of_a_cute_band_name/
t3_ksc1vm,FBI seeking information on people who stormed the Capitol,https://www.reddit.com/r/democrats/comments/ksc1vm/fbi_seeking_information_on_people_who_stormed_the/
t3_ksr1ws,The Aftermath of Democracy s Funeral  How Did We Get Here ,https://www.reddit.com/r/democrats/comments/ksr1ws/the_aftermath_of_democracys_funeral_how_did_we/
t3_ksqyvw,Get a load of this bullsh t,https://www.reddit.com/r/democrats/comments/ksqyvw/get_a_load_of_this_bullsht/
t3_ks7wiy,The Lincoln Project  We made this pre election  thinking that we d never have to release it. After the events of today  we decided to post   Bloodlines,https://www.reddit.com/r/democrats/comments/ks7wiy/the_lincoln_project_we_made_this_preelection/
t3_ks4qz4,Remember that time Ted Cruz was surprised that spreading extremist views caused extremist actions ,https://www.reddit.com/r/democrats/comments/ks4qz4/remember_that_time_ted_cruz_was_surprised_that/
t3_ksm6mk,It feels like such a ridiculous leap but I was wondering if there was anything definitive against it that I could use,https://www.reddit.com/r/democrats/comments/ksm6mk/it_feels_like_such_a_ridiculous_leap_but_i_was/
t3_ks22ul,Bookending the Trump presidency,https://www.reddit.com/r/democrats/comments/ks22ul/bookending_the_trump_presidency/
t3_krwnuk, What  he did what..he actually did it. He tried to over throw his own government.. I didnt think he had the balls ,https://www.reddit.com/r/democrats/comments/krwnuk/what_he_did_whathe_actually_did_it_he_tried_to/
