name,title,url_comments
t3_kv4lr7,House Democrats launch second impeachment of Trump for his role in last week s deadly Capitol attack,https://www.reddit.com/r/democrats/comments/kv4lr7/house_democrats_launch_second_impeachment_of/
t3_kvg3xu,Do I have to ,https://www.reddit.com/r/democrats/comments/kvg3xu/do_i_have_to/
t3_kv4oca, Camp Auschwitz  guy identified ,https://www.reddit.com/r/democrats/comments/kv4oca/camp_auschwitz_guy_identified/
t3_kvekkt,No Crawling Back   ,https://www.reddit.com/r/democrats/comments/kvekkt/no_crawling_back/
t3_kvfqwa,Use the 14th Amendment to ban Trump,https://www.reddit.com/r/democrats/comments/kvfqwa/use_the_14th_amendment_to_ban_trump/
t3_kvg5ha,Arguing with Republicans Over the Storming of the Capitol,https://www.reddit.com/r/democrats/comments/kvg5ha/arguing_with_republicans_over_the_storming_of_the/
t3_kvhzy8, There will be Trump Supporters who try to kill us   says Republican congressman on going against Trump,https://www.reddit.com/r/democrats/comments/kvhzy8/there_will_be_trump_supporters_who_try_to_kill_us/
t3_kvh5nr,Patriots coach Bill Belichick turns down Presidential Medal of Freedom from Trump,https://www.reddit.com/r/democrats/comments/kvh5nr/patriots_coach_bill_belichick_turns_down/
t3_kvkgtt,Most of the arrests from the Capitol riots have been misdemeanor curfew violations. This searchable table shows everyone charged so far.,https://www.reddit.com/r/democrats/comments/kvkgtt/most_of_the_arrests_from_the_capitol_riots_have/
t3_kvfbhb,QAnon congresswoman who live tweeted Nancy Pelosi s location to rioters now facing calls for arrest,https://www.reddit.com/r/democrats/comments/kvfbhb/qanon_congresswoman_who_livetweeted_nancy_pelosis/
t3_kvlmp3,Twitter announced that it has suspended more than 70 000 accounts associated with the far right QAnon conspiracy theory.  These accounts were engaged in sharing harmful QAnon associated content at scale and were primarily dedicated to the propagation of this conspiracy theory across the service ,https://www.reddit.com/r/democrats/comments/kvlmp3/twitter_announced_that_it_has_suspended_more_than/
t3_kuzm3s,QAnon congresswoman faces calls for arrest after live tweeting Nancy Pelosi s location to rioters,https://www.reddit.com/r/democrats/comments/kuzm3s/qanon_congresswoman_faces_calls_for_arrest_after/
t3_kv48ks,Nancy Pelosi on Twitter  The person who is running the Executive Branch of our government is deranged  unhinged  and dangerous.,https://www.reddit.com/r/democrats/comments/kv48ks/nancy_pelosi_on_twitter_the_person_who_is_running/
t3_kvjgk8,PayPal blocks site that helped raise funds for those who attended Capitol violence,https://www.reddit.com/r/democrats/comments/kvjgk8/paypal_blocks_site_that_helped_raise_funds_for/
t3_kusuk4,Thank you Officer Eugene Goodman ,https://www.reddit.com/r/democrats/comments/kusuk4/thank_you_officer_eugene_goodman/
t3_kved22,A mysterious group once funded by conservative millionaire Robert Mercer promoted both the rally featuring President Trump and the ensuing march on Capitol Hill that led to a deadly riot last week,https://www.reddit.com/r/democrats/comments/kved22/a_mysterious_group_once_funded_by_conservative/
t3_kv772e,Impossible,https://www.reddit.com/r/democrats/comments/kv772e/impossible/
t3_kvgxel,Every Deleted Parler Post  Many With Users  Location Data  Has Been Archived,https://www.reddit.com/r/democrats/comments/kvgxel/every_deleted_parler_post_many_with_users/
t3_kv5s4o,Hillary Clinton  Trump should be impeached. But that alone won t remove white supremacy from America.,https://www.reddit.com/r/democrats/comments/kv5s4o/hillary_clinton_trump_should_be_impeached_but/
t3_kvdqw0,The Latest  Acting Homeland Security chief Wolf is resigning,https://www.reddit.com/r/democrats/comments/kvdqw0/the_latest_acting_homeland_security_chief_wolf_is/
t3_kvgar9,FBI warns of possible  armed protests  across U.S. before Biden s inauguration,https://www.reddit.com/r/democrats/comments/kvgar9/fbi_warns_of_possible_armed_protests_across_us/
t3_kvksvo,Inside the remarkable rift between Donald Trump and Mike Pence,https://www.reddit.com/r/democrats/comments/kvksvo/inside_the_remarkable_rift_between_donald_trump/
t3_kvif3b,Lt. Gen. Walter Piatt  the director of the Army Staff  on Monday disputed former Capitol Police Chief Steven Sund s account of how and when the National Guard was deployed to assist with Wednesday s Capitol riots  saying that he did not push back against calls for deployment,https://www.reddit.com/r/democrats/comments/kvif3b/lt_gen_walter_piatt_the_director_of_the_army/
t3_kvmbe1, How did it get to this    Minnesotans react to violence  chaos at U.S. Capitol,https://www.reddit.com/r/democrats/comments/kvmbe1/how_did_it_get_to_this_minnesotans_react_to/
t3_kvkohn,What is Gab  The far right social media site that Google and Apple banned and that is still gaining thousands of new users after Twitter and Facebook deplatformed Trump,https://www.reddit.com/r/democrats/comments/kvkohn/what_is_gab_the_farright_social_media_site_that/
t3_kvh3k1,Republicans sounded alarm against Trump  then ignored the warning   CNN Video,https://www.reddit.com/r/democrats/comments/kvh3k1/republicans_sounded_alarm_against_trump_then/
t3_kvc8om,Congresswoman says she tested positive for COVID 19 after sheltering during Capitol coup attempt with  several colleagues who refused to wear masks ,https://www.reddit.com/r/democrats/comments/kvc8om/congresswoman_says_she_tested_positive_for/
t3_kvkx5q,When can I expect my updated  2000 stimulus check    ,https://www.reddit.com/r/democrats/comments/kvkx5q/when_can_i_expect_my_updated_2000_stimulus_check/
t3_kvkqmi,Honest question. Where were these men during the insurrection ,https://www.reddit.com/r/democrats/comments/kvkqmi/honest_question_where_were_these_men_during_the/
t3_kvkppl,These are the banks that Ted Cruz s senate election committee does business with.,https://www.reddit.com/r/democrats/comments/kvkppl/these_are_the_banks_that_ted_cruzs_senate/
t3_kvgcc0,Manatee With  Trump  Etched Onto Back Found in Florida,https://www.reddit.com/r/democrats/comments/kvgcc0/manatee_with_trump_etched_onto_back_found_in/
t3_kv6i5q,We know who these groups are 3 ers Oath keepers Proud boys 4chan Groypher army Nationalist Social Club NSC and several others. Why have they not been designated as terrorists orginiaztions. So anyone person or company that gives them aid can be prosecuted.,https://www.reddit.com/r/democrats/comments/kv6i5q/we_know_who_these_groups_are_3ers_oath_keepers/
t3_kvlxqj,This is from a film nearly a decade ago. It hits so close to home.,https://www.reddit.com/r/democrats/comments/kvlxqj/this_is_from_a_film_nearly_a_decade_ago_it_hits/
t3_kvh010,Dead giveaway ,https://www.reddit.com/r/democrats/comments/kvh010/dead_giveaway/
t3_kvfxpg,Facebook executive says  no plans  to lift Trump suspension,https://www.reddit.com/r/democrats/comments/kvfxpg/facebook_executive_says_no_plans_to_lift_trump/
t3_kvjmzi,Our modern day heroes ,https://www.reddit.com/r/democrats/comments/kvjmzi/our_modern_day_heroes/
t3_kvgo9d,Fact check  Donald Trump has not invoked the Insurrection Act to hold on to power,https://www.reddit.com/r/democrats/comments/kvgo9d/fact_check_donald_trump_has_not_invoked_the/
t3_kv5fj6,Trump Supporters saying that they want to torture and kill Democrat s kids and entire families,https://www.reddit.com/r/democrats/comments/kv5fj6/trump_supporters_saying_that_they_want_to_torture/
t3_kvm028,GIGACUCK Lindsey Graham sells soul to defend Daddy Trump,https://www.reddit.com/r/democrats/comments/kvm028/gigacuck_lindsey_graham_sells_soul_to_defend/
t3_kv9mhk,Its rare I see a good meme on FB first.,https://www.reddit.com/r/democrats/comments/kv9mhk/its_rare_i_see_a_good_meme_on_fb_first/
t3_kvaplw,Republicans respond to Trump riot with hollow calls for healing,https://www.reddit.com/r/democrats/comments/kvaplw/republicans_respond_to_trump_riot_with_hollow/
t3_kve3ll, Democracy in tatters  A simple comparison.,https://www.reddit.com/r/democrats/comments/kve3ll/democracy_in_tatters_a_simple_comparison/
t3_kvbr14,House Democrat blames Covid diagnosis on lawmakers who didn t wear masks while sheltering,https://www.reddit.com/r/democrats/comments/kvbr14/house_democrat_blames_covid_diagnosis_on/
t3_kv7v4z,Thousands of Yale and Harvard law school alumni and students petition for Cruz and Hawley to be disbarred,https://www.reddit.com/r/democrats/comments/kv7v4z/thousands_of_yale_and_harvard_law_school_alumni/
t3_kvf0zj,Area Police Officers Suspended For Alleged Actions During Insurrection,https://www.reddit.com/r/democrats/comments/kvf0zj/area_police_officers_suspended_for_alleged/
t3_kvg00b,Trump warned of bank draining OJ Simpson style civil suits if he self pardons,https://www.reddit.com/r/democrats/comments/kvg00b/trump_warned_of_bankdraining_oj_simpsonstyle/
t3_kvfz5h,Hogan Gidley Insists to Fox News  Trump Is the  Most Masculine Person Ever  ,https://www.reddit.com/r/democrats/comments/kvfz5h/hogan_gidley_insists_to_fox_news_trump_is_the/
t3_kv8ro0,If the Capitol Mob Would Have Found Democratic Leaders  they Would Have Been Kidnapped  Beaten and Killed. Don t let the rioters off the hook.,https://www.reddit.com/r/democrats/comments/kv8ro0/if_the_capitol_mob_would_have_found_democratic/
t3_kv4hw1,Right wing extremists vow to return to Washington for Joe Biden s inauguration. OK  plans are that due to the  Rona only 1000 participants will be allowed at the Inauguration. But unlimited Republican anti democracy activists can demonstrate against Biden s Inauguration.,https://www.reddit.com/r/democrats/comments/kv4hw1/rightwing_extremists_vow_to_return_to_washington/
t3_kvgwx2,Facebook appoints civil rights vice president amid pressure over racial hatred  violence on Facebook  Instagram,https://www.reddit.com/r/democrats/comments/kvgwx2/facebook_appoints_civil_rights_vice_president/
t3_kug7s9,Mitch McConnell can become the hero of this story if He expels senators involved in the insurgency And tells Pelosi send me the articles of impeachment and I will put them to a quick vote. Otherwise he is a piece of shit doomed to his terrible legacy.,https://www.reddit.com/r/democrats/comments/kug7s9/mitch_mcconnell_can_become_the_hero_of_this_story/
t3_kv7g7m,Have FOX News Removed from Cable TV,https://www.reddit.com/r/democrats/comments/kv7g7m/have_fox_news_removed_from_cable_tv/
t3_kvm1bz,Three New Terrifying Plots To Overthrow Government,https://www.reddit.com/r/democrats/comments/kvm1bz/three_new_terrifying_plots_to_overthrow_government/
t3_kurf19,The 147 Republicans Who Voted to Overturn Election Results   Let s start the campaign to end their political careers.,https://www.reddit.com/r/democrats/comments/kurf19/the_147_republicans_who_voted_to_overturn/
t3_kvf4ue,How do we deescalate the situation we find ourselves in if armed protesters refuse to accept the outcome of the election or the findings of the legal and investigate process  How do we preserve our democracy ,https://www.reddit.com/r/democrats/comments/kvf4ue/how_do_we_deescalate_the_situation_we_find/
t3_kv55pn,Trump Has Incited Violence All Along. The GOP Just Didn t Care Until Now.,https://www.reddit.com/r/democrats/comments/kv55pn/trump_has_incited_violence_all_along_the_gop_just/
t3_kvdvyo,Right wing app Parler booted off internet over ties to siege,https://www.reddit.com/r/democrats/comments/kvdvyo/rightwing_app_parler_booted_off_internet_over/
t3_kv7fka,New York Bar Association launches probe to expel Giuliani,https://www.reddit.com/r/democrats/comments/kv7fka/new_york_bar_association_launches_probe_to_expel/
t3_kutdj1,Such a disgrace,https://www.reddit.com/r/democrats/comments/kutdj1/such_a_disgrace/
t3_kuuhhq,Q congresswoman live tweeted speaker NP location during riot,https://www.reddit.com/r/democrats/comments/kuuhhq/q_congresswoman_live_tweeted_speaker_np_location/
t3_kvjafu,Law and Order,https://www.reddit.com/r/democrats/comments/kvjafu/law_and_order/
t3_kvj8ih,Nikki Fried  Manny Diaz condemn Florida AG Ashley Moody s involvement in group that sent calls asking people to march on Capitol,https://www.reddit.com/r/democrats/comments/kvj8ih/nikki_fried_manny_diaz_condemn_florida_ag_ashley/
t3_kvfwcl,Two US Capitol police officers suspended over Trump riot  says lawmaker,https://www.reddit.com/r/democrats/comments/kvfwcl/two_us_capitol_police_officers_suspended_over/
t3_kvj2mx,The Government Told States To Put People With Disabilities TO THE BACK OF THE LINE For Coronavirus Treatment,https://www.reddit.com/r/democrats/comments/kvj2mx/the_government_told_states_to_put_people_with/
t3_kv9gcu,Opinion   Impeach Trump. Then Arrest Trump. Then Prosecute Him for Sedition   ,https://www.reddit.com/r/democrats/comments/kv9gcu/opinion_impeach_trump_then_arrest_trump_then/
t3_kvgg5n,Gov. Doug Ducey says he s used  right touch  on pandemic as Arizona s COVID 19 death toll tops 10 000  and is the hot spot of the world as of Jan. 7th.,https://www.reddit.com/r/democrats/comments/kvgg5n/gov_doug_ducey_says_hes_used_right_touch_on/
t3_kvbrfo,FBI warns of plans for nationwide armed protests next week,https://www.reddit.com/r/democrats/comments/kvbrfo/fbi_warns_of_plans_for_nationwide_armed_protests/
t3_kvdjq2,FBI warns  armed protests  being planned at all 50 state capitols and in Washington DC,https://www.reddit.com/r/democrats/comments/kvdjq2/fbi_warns_armed_protests_being_planned_at_all_50/
t3_kvk1ip,Manatee With  Trump  Etched Into Back Sparks Federal Investigation,https://www.reddit.com/r/democrats/comments/kvk1ip/manatee_with_trump_etched_into_back_sparks/
t3_kv07my,Sorry  Joe  but We Can t Move On Without Punishing Trump for His Crimes Against Democracy,https://www.reddit.com/r/democrats/comments/kv07my/sorry_joe_but_we_cant_move_on_without_punishing/
t3_kv60ih,So Senator Cruz  when can we introduce the Republican Terrorist Designation Act ,https://www.reddit.com/r/democrats/comments/kv60ih/so_senator_cruz_when_can_we_introduce_the/
t3_kvjj41,ByeByeFelicia..........,https://www.reddit.com/r/democrats/comments/kvjj41/byebyefelicia/
t3_kvbiqz,Hit  em where it hurts  Call  complain  boycott  whatever you can do.,https://www.reddit.com/r/democrats/comments/kvbiqz/hit_em_where_it_hurts_call_complain_boycott/
t3_kvavci,FBI warns of armed protests  National Guard authorized to protect Biden inauguration,https://www.reddit.com/r/democrats/comments/kvavci/fbi_warns_of_armed_protests_national_guard/
t3_kvchrj,I wonder if the Trumplicans plan to trade in their stimulus checks for fake Trump money.,https://www.reddit.com/r/democrats/comments/kvchrj/i_wonder_if_the_trumplicans_plan_to_trade_in/
t3_kv4ocq, Camp Auschwitz  guy identified ,https://www.reddit.com/r/democrats/comments/kv4ocq/camp_auschwitz_guy_identified/
t3_kvb9ma,Hack  Hoax ,https://www.reddit.com/r/democrats/comments/kvb9ma/hack_hoax/
t3_kvat4s,U.S. House introduces impeachment article accusing Trump of  incitement of insurrection    CBC News,https://www.reddit.com/r/democrats/comments/kvat4s/us_house_introduces_impeachment_article_accusing/
t3_kveez4,Capitol s double standard  2014 Lakota song,https://www.reddit.com/r/democrats/comments/kveez4/capitols_double_standard_2014_lakota_song/
t3_kvcovf,Replacing News with Fake News,https://www.reddit.com/r/democrats/comments/kvcovf/replacing_news_with_fake_news/
t3_kvf3ez,Stan Van Gundy reacts to Capitol Riots,https://www.reddit.com/r/democrats/comments/kvf3ez/stan_van_gundy_reacts_to_capitol_riots/
t3_kvb3ux,Officer resigns as Army investigates her involvement in Washington rally that led to U.S. Capitol riot,https://www.reddit.com/r/democrats/comments/kvb3ux/officer_resigns_as_army_investigates_her/
t3_kvdc0k,Saint for the cause,https://www.reddit.com/r/democrats/comments/kvdc0k/saint_for_the_cause/
t3_kv314p,Melania Identifies Real Victim of the Deadly Capitol Riots  Herself,https://www.reddit.com/r/democrats/comments/kv314p/melania_identifies_real_victim_of_the_deadly/
t3_kvfsvc,As tech giants recoil from Trump and Parler  is free speech at risk ,https://www.reddit.com/r/democrats/comments/kvfsvc/as_tech_giants_recoil_from_trump_and_parler_is/
t3_kvlrca,Trump acknowledged he bears some blame for Capitol riot in conversation with McCarthy  sources,https://www.reddit.com/r/democrats/comments/kvlrca/trump_acknowledged_he_bears_some_blame_for/
t3_kv8lkc,Can we post memes here  This is my first attempt at  OC,https://www.reddit.com/r/democrats/comments/kv8lkc/can_we_post_memes_here_this_is_my_first_attempt/
t3_kv9b9d,Former Capitol Police Chief Steven Sund s request for National Guard backup was denied  he says in interview,https://www.reddit.com/r/democrats/comments/kv9b9d/former_capitol_police_chief_steven_sunds_request/
t3_kvadhx,Trump s New Criminal Problem,https://www.reddit.com/r/democrats/comments/kvadhx/trumps_new_criminal_problem/
t3_kv9xzr,It s so badass when people stand in front of things they destroyed  original meme by u redditsucks690 on r teenagers  ik the white house isn t the capitol  im using it to represent the US government ,https://www.reddit.com/r/democrats/comments/kv9xzr/its_so_badass_when_people_stand_in_front_of/
t3_kv72wi,To Honor Those Who Defended This Country From a Right Wing Coup Attempt,https://www.reddit.com/r/democrats/comments/kv72wi/to_honor_those_who_defended_this_country_from_a/
t3_kuserw,Guy in Pelosi s office that got arrested.  ,https://www.reddit.com/r/democrats/comments/kuserw/guy_in_pelosis_office_that_got_arrested/
t3_kv5bp7,Tragic Irony   Capitol Rioter trampled carrying  Don t Tread on Me  Gadsden flag,https://www.reddit.com/r/democrats/comments/kv5bp7/tragic_irony_capitol_rioter_trampled_carrying/
t3_kv90aq,What underground news are they talking about and what could possibly happen on January 20th  A larger  weapon infused seige ,https://www.reddit.com/r/democrats/comments/kv90aq/what_underground_news_are_they_talking_about_and/
t3_kv6wni,Anyone complaining about freedom of speech being revoked by tech companies. Comparing this to China  Russia  Iran or North Korea. Remember this would have never had happened in these countries one whiff of insurrection and people would disappear. 1 6 21 would have been known only as Wednesday.,https://www.reddit.com/r/democrats/comments/kv6wni/anyone_complaining_about_freedom_of_speech_being/
t3_kva5s5,Anyone up to raid r gab    ,https://www.reddit.com/r/democrats/comments/kva5s5/anyone_up_to_raid_rgab/
t3_kv8sm0,Scraped Parler data is a metadata goldmine,https://www.reddit.com/r/democrats/comments/kv8sm0/scraped_parler_data_is_a_metadata_goldmine/
t3_kuvu87,To the Republicans who are crying about big tech  censorship  and are confused as to why de platforming is being allowed  Allow me to introduce you to....your own past actions.,https://www.reddit.com/r/democrats/comments/kuvu87/to_the_republicans_who_are_crying_about_big_tech/
t3_kv4b72,NeverTrump conservatives continue producing some of my favorite political writing of the Trump era   Conservatism Reaches a Dead End   by David Frum,https://www.reddit.com/r/democrats/comments/kv4b72/nevertrump_conservatives_continue_producing_some/
t3_kv23lo, This was domestic terrorism   Rep. Mace speaks on Capitol rioting  backs censuring Trump,https://www.reddit.com/r/democrats/comments/kv23lo/this_was_domestic_terrorism_rep_mace_speaks_on/
t3_kv0k1b,Police departments across US investigating whether their own members took part in the Capitol riots,https://www.reddit.com/r/democrats/comments/kv0k1b/police_departments_across_us_investigating/
t3_kuw2xh,Surprise  Surprise  Off Duty Cops From All Over the Country Were in D.C. During Capitol Coup Attempt...,https://www.reddit.com/r/democrats/comments/kuw2xh/surprise_surprise_offduty_cops_from_all_over_the/
t3_kut4i8,After Capitol siege  majority in new poll says Trump should be removed from office before term ends,https://www.reddit.com/r/democrats/comments/kut4i8/after_capitol_siege_majority_in_new_poll_says/
t3_kupljs,Powell leaves republican party,https://www.reddit.com/r/democrats/comments/kupljs/powell_leaves_republican_party/
t3_kv9l7z,Coronavirus Vaccine  The Ultimate Waiting Game,https://www.reddit.com/r/democrats/comments/kv9l7z/coronavirus_vaccine_the_ultimate_waiting_game/
t3_kv19le,Biden chooses veteran diplomat Burns as CIA director,https://www.reddit.com/r/democrats/comments/kv19le/biden_chooses_veteran_diplomat_burns_as_cia/
t3_kv5n49, Welcome to the White Parade   parody ,https://www.reddit.com/r/democrats/comments/kv5n49/welcome_to_the_white_parade_parody/
t3_kuw5fx,Republicans ask Biden to stop impeachment in the  spirit of healing.  AOC says that s BS   ,https://www.reddit.com/r/democrats/comments/kuw5fx/republicans_ask_biden_to_stop_impeachment_in_the/
t3_kv1pqa,IL congresswoman says  Hitler was right about one thing ,https://www.reddit.com/r/democrats/comments/kv1pqa/il_congresswoman_says_hitler_was_right_about_one/
t3_kuu3fc,Man in  Camp Auschwitz  NAZI sweatshirt during Capitol riot identified,https://www.reddit.com/r/democrats/comments/kuu3fc/man_in_camp_auschwitz_nazi_sweatshirt_during/
t3_kuqexm,Major companies begin suspending donations to Republicans involved in biden cert. Challenge,https://www.reddit.com/r/democrats/comments/kuqexm/major_companies_begin_suspending_donations_to/
t3_kv0ays,New video shows rioters beating police officer on Capitol Hill steps   CNN Video,https://www.reddit.com/r/democrats/comments/kv0ays/new_video_shows_rioters_beating_police_officer_on/
t3_kukwac,Friendly reminder that Ted Cruz was personally involved the last time an election was actually stolen  too,https://www.reddit.com/r/democrats/comments/kukwac/friendly_reminder_that_ted_cruz_was_personally/
t3_kv770v,Live feed Twitter HQ,https://www.reddit.com/r/democrats/comments/kv770v/live_feed_twitter_hq/
t3_kuw69y,At least 25 people under investigation for terrorism in connection with Capitol riot   ,https://www.reddit.com/r/democrats/comments/kuw69y/at_least_25_people_under_investigation_for/
t3_kut2gg,Three of Rep. Paul Gosar s siblings have reached out to Rep. Ra l Grijalva asking him to help get their brother expelled from Congress after the deadly riot at the U.S. Capitol they blame him for helping to instigate,https://www.reddit.com/r/democrats/comments/kut2gg/three_of_rep_paul_gosars_siblings_have_reached/
t3_kutf4q,Marriott and others pledge to cut off money to members of Congress who doubted Biden win,https://www.reddit.com/r/democrats/comments/kutf4q/marriott_and_others_pledge_to_cut_off_money_to/
t3_kuw3pi,Pelosi  MAGA Mob Was  Organized  and  Directed to Get People    ,https://www.reddit.com/r/democrats/comments/kuw3pi/pelosi_maga_mob_was_organized_and_directed_to_get/
t3_kuncx1,Period.,https://www.reddit.com/r/democrats/comments/kuncx1/period/
t3_kujcyc,Op Ed in the Kansas City Star. The hypocrite trumpers kill policemen. It s just a fact.,https://www.reddit.com/r/democrats/comments/kujcyc/op_ed_in_the_kansas_city_star_the_hypocrite/
t3_kuiwet,And the winner is   ,https://www.reddit.com/r/democrats/comments/kuiwet/and_the_winner_is/
t3_kuex1l,After Capitol siege  majority of Americans say Trump should be removed from office before term ends  Poll,https://www.reddit.com/r/democrats/comments/kuex1l/after_capitol_siege_majority_of_americans_say/
t3_kuwiyo,The phrase  storm the Capitol  was used 100 000 times online in the month leading up to the mob   ,https://www.reddit.com/r/democrats/comments/kuwiyo/the_phrase_storm_the_capitol_was_used_100000/
t3_kuoc8x,So wise.,https://www.reddit.com/r/democrats/comments/kuoc8x/so_wise/
t3_kuuime,Taken one day apart.,https://www.reddit.com/r/democrats/comments/kuuime/taken_one_day_apart/
t3_kumcuf,No.,https://www.reddit.com/r/democrats/comments/kumcuf/no/
t3_kuthab,Anyone else need this for some friends ,https://www.reddit.com/r/democrats/comments/kuthab/anyone_else_need_this_for_some_friends/
t3_kunvq3,Unfortunately this is reality ,https://www.reddit.com/r/democrats/comments/kunvq3/unfortunately_this_is_reality/
t3_kug2m7,POWERFUL  Governor Schwarzenegger s Message Following this Week s Attack on the Capitol,https://www.reddit.com/r/democrats/comments/kug2m7/powerful_governor_schwarzeneggers_message/
t3_kumalq,GOP senators urge Trump to resign  impeachment gains support,https://www.reddit.com/r/democrats/comments/kumalq/gop_senators_urge_trump_to_resign_impeachment/
t3_kuyam3,Pelosi says House will move on impeachment if other efforts to remove Trump fail,https://www.reddit.com/r/democrats/comments/kuyam3/pelosi_says_house_will_move_on_impeachment_if/
t3_kun5ef,The moment Officer Brian Sicknick is dragged into a mob and beaten  any doubts about impeachment now  ,https://www.reddit.com/r/democrats/comments/kun5ef/the_moment_officer_brian_sicknick_is_dragged_into/
t3_kuk92n,      ,https://www.reddit.com/r/democrats/comments/kuk92n/_/
t3_kuuflv,Students Trained for Active Shooters Give Advice to Members of Congress,https://www.reddit.com/r/democrats/comments/kuuflv/students_trained_for_active_shooters_give_advice/
t3_kush0v,When you re white they let you do.,https://www.reddit.com/r/democrats/comments/kush0v/when_youre_white_they_let_you_do/
t3_kux7tq,Twitter braces for pro Trump rally at its US headquarters,https://www.reddit.com/r/democrats/comments/kux7tq/twitter_braces_for_protrump_rally_at_its_us/
t3_kusyli,Is it Time to Shun Our QAnon Family ,https://www.reddit.com/r/democrats/comments/kusyli/is_it_time_to_shun_our_qanon_family/
t3_kukhfh,December s jobs report confirms Trump is set to be the worst jobs president on record,https://www.reddit.com/r/democrats/comments/kukhfh/decembers_jobs_report_confirms_trump_is_set_to_be/
t3_kuhmex,Straight talk  Trump is an enemy of democracy and his Capitol enablers are co conspirators,https://www.reddit.com/r/democrats/comments/kuhmex/straight_talk_trump_is_an_enemy_of_democracy_and/
