name,title,url_comments
t3_ktua9p,Is this what you meant   OC ,https://www.reddit.com/r/democrats/comments/ktua9p/is_this_what_you_meant_oc/
t3_ktimgw,Help the fbi identify this guy. He was inside the capitol.,https://www.reddit.com/r/democrats/comments/ktimgw/help_the_fbi_identify_this_guy_he_was_inside_the/
t3_ktxv9s,It s this  then.,https://www.reddit.com/r/democrats/comments/ktxv9s/its_this_then/
t3_ksvr5t,Golf clap,https://www.reddit.com/r/democrats/comments/ksvr5t/golf_clap/
t3_ktjbpu,A video surfaced Friday night of Republican Oregon Rep. Mike Nearman pushing a door open as he exited the state Capitol  allowing protesters to enter the building as a legislative session was underway,https://www.reddit.com/r/democrats/comments/ktjbpu/a_video_surfaced_friday_night_of_republican/
t3_ktpm7s,The Missing Link found,https://www.reddit.com/r/democrats/comments/ktpm7s/the_missing_link_found/
t3_kthig8,FBI Smacks Right Wing Media With Stinging Fact Check  No Sign Antifa Stormed Capitol   ,https://www.reddit.com/r/democrats/comments/kthig8/fbi_smacks_rightwing_media_with_stinging/
t3_kt5bi2,Is it possible to overdose on schadenfreude  Asking for well over half of American voters.,https://www.reddit.com/r/democrats/comments/kt5bi2/is_it_possible_to_overdose_on_schadenfreude/
t3_ktepeq,Permanent suspension of  realDonaldTrump,https://www.reddit.com/r/democrats/comments/ktepeq/permanent_suspension_of_realdonaldtrump/
t3_ktj9xo,The greatest rant EVER ,https://www.reddit.com/r/democrats/comments/ktj9xo/the_greatest_rant_ever/
t3_ktt9fh,Literally Trump.,https://www.reddit.com/r/democrats/comments/ktt9fh/literally_trump/
t3_ktcsgj,Alaska Sen. Lisa Murkowski calls on President Trump to resign  questions her future as a Republican,https://www.reddit.com/r/democrats/comments/ktcsgj/alaska_sen_lisa_murkowski_calls_on_president/
t3_ktntgi,Exposed  Police Double Standards From Trump Riot To BLM Protests,https://www.reddit.com/r/democrats/comments/ktntgi/exposed_police_double_standards_from_trump_riot/
t3_ktr464,Do you find it hard to mask your delight in the epic fall of Trump and his merry band of henchmen  Are you irrationally gleeful with the daily news and it s revelatory glimpse into their pending doom  Is your schadenfruede showing  Ask your doctor is Schadenfree is right for you.,https://www.reddit.com/r/democrats/comments/ktr464/do_you_find_it_hard_to_mask_your_delight_in_the/
t3_ktz4uu,Joe Manchin is a Confederate simp,https://www.reddit.com/r/democrats/comments/ktz4uu/joe_manchin_is_a_confederate_simp/
t3_ktf5df,Why aren t we talking about Emily Murphy anymore  She has so much blood on her hands for not starting the transition process sooner. She needs to be held accountable.,https://www.reddit.com/r/democrats/comments/ktf5df/why_arent_we_talking_about_emily_murphy_anymore/
t3_ktijsf,HOW DO I USE TICTOC ,https://www.reddit.com/r/democrats/comments/ktijsf/how_do_i_use_tictoc/
t3_kti7nv,Posted without comment,https://www.reddit.com/r/democrats/comments/kti7nv/posted_without_comment/
t3_ktirx4,Two idiots walk into the bar....,https://www.reddit.com/r/democrats/comments/ktirx4/two_idiots_walk_into_the_bar/
t3_kttoym,This is a great commentary ...,https://www.reddit.com/r/democrats/comments/kttoym/this_is_a_great_commentary/
t3_ktkfv4,Mark Joseph Stern   On the morning of Jan 6  Ginni Thomas wife of Supreme Court Justice Clarence Thomas endorsed the protest demanding that Congress overturn the election  then sent her  LOVE  to the demonstrators  who violently overtook the Capitol several hours later. She has not posted since,https://www.reddit.com/r/democrats/comments/ktkfv4/mark_joseph_stern_on_the_morning_of_jan_6_ginni/
t3_kt6jj7,Newspaper from Nigeria,https://www.reddit.com/r/democrats/comments/kt6jj7/newspaper_from_nigeria/
t3_ktjb4f,Alex Jones says he paid  500 000 for rally that led to Capitol riot,https://www.reddit.com/r/democrats/comments/ktjb4f/alex_jones_says_he_paid_500000_for_rally_that_led/
t3_ktx5fw,Strangest US Presidential Inauguration Events,https://www.reddit.com/r/democrats/comments/ktx5fw/strangest_us_presidential_inauguration_events/
t3_kte1wo,Found on this on another subreddit  but I think we can all agree on this,https://www.reddit.com/r/democrats/comments/kte1wo/found_on_this_on_another_subreddit_but_i_think_we/
t3_kth5k7,Banned.,https://www.reddit.com/r/democrats/comments/kth5k7/banned/
t3_kt87yk,Pelosi tells caucus there s more Democratic support for impeachment than in 2019,https://www.reddit.com/r/democrats/comments/kt87yk/pelosi_tells_caucus_theres_more_democratic/
t3_ktbnik,Reddit bans subreddit group  r DonaldTrump ,https://www.reddit.com/r/democrats/comments/ktbnik/reddit_bans_subreddit_group_rdonaldtrump/
t3_ktdnfc,Insurrection mob members had zip ties planned on taking elected officials hostage.,https://www.reddit.com/r/democrats/comments/ktdnfc/insurrection_mob_members_had_zip_ties_planned_on/
t3_ktjfxv,Biden considered Bernie Sanders to helm Labor  but Democratic control of Senate came first,https://www.reddit.com/r/democrats/comments/ktjfxv/biden_considered_bernie_sanders_to_helm_labor_but/
t3_ktjtgl,Behind the viral photo of Rep. Andy Kim cleaning up at midnight after riots,https://www.reddit.com/r/democrats/comments/ktjtgl/behind_the_viral_photo_of_rep_andy_kim_cleaning/
t3_kteud5,Twitter bans President Trump permanently,https://www.reddit.com/r/democrats/comments/kteud5/twitter_bans_president_trump_permanently/
t3_ktbdwp,Derrick Evans  the West Virginia lawmaker who stormed the Capitol  has been arrested by the FBI.,https://www.reddit.com/r/democrats/comments/ktbdwp/derrick_evans_the_west_virginia_lawmaker_who/
t3_ktizqg,Spoiler alert  It s all pictures,https://www.reddit.com/r/democrats/comments/ktizqg/spoiler_alert_its_all_pictures/
t3_kth6wb,HALLELUJAH,https://www.reddit.com/r/democrats/comments/kth6wb/hallelujah/
t3_ktgnnu,Michael Rapaport Reacts to Trump TWITTER BAN ,https://www.reddit.com/r/democrats/comments/ktgnnu/michael_rapaport_reacts_to_trump_twitter_ban/
t3_kt8zgm,Man with foot up on desk in Pelosi s office at Capitol arrested   ,https://www.reddit.com/r/democrats/comments/kt8zgm/man_with_foot_up_on_desk_in_pelosis_office_at/
t3_ktg9yl,A Terrified President Throws His Riot Mob Under A Bus To Save His Neck  And Get Back On Twitter ,https://www.reddit.com/r/democrats/comments/ktg9yl/a_terrified_president_throws_his_riot_mob_under_a/
t3_ktkic4,I m lost please read my comment if you can,https://www.reddit.com/r/democrats/comments/ktkic4/im_lost_please_read_my_comment_if_you_can/
t3_ktf445,A bit late  but FINALLY. He is permanently banned.  THANK YOU TWITTER  is top trending.,https://www.reddit.com/r/democrats/comments/ktf445/a_bit_late_but_finally_he_is_permanently_banned/
t3_kte3pq,Capitol riot was openly organized on mainstream social media,https://www.reddit.com/r/democrats/comments/kte3pq/capitol_riot_was_openly_organized_on_mainstream/
t3_kta3k4,Increasing Calls For Texas Sen. Ted Cruz To Resign,https://www.reddit.com/r/democrats/comments/kta3k4/increasing_calls_for_texas_sen_ted_cruz_to_resign/
t3_kt5exm,well said,https://www.reddit.com/r/democrats/comments/kt5exm/well_said/
t3_ktj3jh,At least he got his wall,https://www.reddit.com/r/democrats/comments/ktj3jh/at_least_he_got_his_wall/
t3_ktfwn9,Pelosi In Talks With Top General About taking away Nuclear codes from Trump,https://www.reddit.com/r/democrats/comments/ktfwn9/pelosi_in_talks_with_top_general_about_taking/
t3_ksv8sp,Another reason why we need DC statehood,https://www.reddit.com/r/democrats/comments/ksv8sp/another_reason_why_we_need_dc_statehood/
t3_ktbzg0, The President Is Both Unfit and a Constitutional Criminal   Congressman Jamie Raskin on Trump s 25th Amendment Crisis And the Likelihood of Impeachment,https://www.reddit.com/r/democrats/comments/ktbzg0/the_president_is_both_unfit_and_a_constitutional/
t3_kti8mc,01 06 2021,https://www.reddit.com/r/democrats/comments/kti8mc/01062021/
t3_kte7k1,Call Your Representatives to Demand Trump s Immediate Impeachment,https://www.reddit.com/r/democrats/comments/kte7k1/call_your_representatives_to_demand_trumps/
t3_ktf2rw,Queue the Hallelujah Chorus ,https://www.reddit.com/r/democrats/comments/ktf2rw/queue_the_hallelujah_chorus/
t3_ktfh1m,The circus has been shut down    sorry  my Twitter s in Swedish but I guess you ve all heard the good news already,https://www.reddit.com/r/democrats/comments/ktfh1m/the_circus_has_been_shut_down_sorry_my_twitters/
t3_kt9mx8, 1 300 000 000.00,https://www.reddit.com/r/democrats/comments/kt9mx8/130000000000/
t3_ktvirb,Donald Trump  teamtrump Instagram page coming for Colin Kaepernick  amp  Jack,https://www.reddit.com/r/democrats/comments/ktvirb/donald_trump_teamtrump_instagram_page_coming_for/
t3_kt7ss7,Pelosi says the House will move to impeach Trump if he doesn t resign  immediately. ,https://www.reddit.com/r/democrats/comments/kt7ss7/pelosi_says_the_house_will_move_to_impeach_trump/
t3_ktg7rg,Here are the people that have lost their jobs after participating in Capitol riots,https://www.reddit.com/r/democrats/comments/ktg7rg/here_are_the_people_that_have_lost_their_jobs/
t3_kte4ov,Lisa Murkowski is first Republican senator to demand Trump leave office,https://www.reddit.com/r/democrats/comments/kte4ov/lisa_murkowski_is_first_republican_senator_to/
t3_ktjcuf,White man who drove into Iowa protesters avoids prison,https://www.reddit.com/r/democrats/comments/ktjcuf/white_man_who_drove_into_iowa_protesters_avoids/
t3_ktewpr,He gone,https://www.reddit.com/r/democrats/comments/ktewpr/he_gone/
t3_ktbpbk,Democratic attorneys general accuse GOP counterpart group of  recruiting  for Capitol riot,https://www.reddit.com/r/democrats/comments/ktbpbk/democratic_attorneys_general_accuse_gop/
t3_ktjx8c,Pro Trump Mob Livestreamed Its Rampage  and Made Money Doing It,https://www.reddit.com/r/democrats/comments/ktjx8c/protrump_mob_livestreamed_its_rampage_and_made/
t3_ktezi6,Democracy Of Course,https://www.reddit.com/r/democrats/comments/ktezi6/democracy_of_course/
t3_kter78,The Deplatforming of President Trump,https://www.reddit.com/r/democrats/comments/kter78/the_deplatforming_of_president_trump/
t3_kten4u,Twitter permanently suspends Trump s account,https://www.reddit.com/r/democrats/comments/kten4u/twitter_permanently_suspends_trumps_account/
t3_ktgdti,I was browsing The Donald s ban evasion website and found this... It gets even worse as you go down... More in comments...,https://www.reddit.com/r/democrats/comments/ktgdti/i_was_browsing_the_donalds_ban_evasion_website/
t3_ktekrl,Dem. lawmaker says Brian Sicknick  Capitol Police officer killed in riot  should lie in state,https://www.reddit.com/r/democrats/comments/ktekrl/dem_lawmaker_says_brian_sicknick_capitol_police/
t3_ksf0j0,  ,https://www.reddit.com/r/democrats/comments/ksf0j0/_/
t3_ktb136,Anyone telling Trump to resign should instead follow Gaffigan s lead  get rid of Pence ahead of impeachment. Don t give Republicans a soft landing to oust Trump ,https://www.reddit.com/r/democrats/comments/ktb136/anyone_telling_trump_to_resign_should_instead/
t3_ktig4b,Kamala Harris dissolving PACs  giving money to charity,https://www.reddit.com/r/democrats/comments/ktig4b/kamala_harris_dissolving_pacs_giving_money_to/
t3_kthlgs,All the platforms that have banned or restricted Trump so far...,https://www.reddit.com/r/democrats/comments/kthlgs/all_the_platforms_that_have_banned_or_restricted/
t3_ktbnxd,I Wonder Why   ,https://www.reddit.com/r/democrats/comments/ktbnxd/i_wonder_why/
t3_ktdcvt,Murkowski becomes first GOP senator to call on Trump to resign,https://www.reddit.com/r/democrats/comments/ktdcvt/murkowski_becomes_first_gop_senator_to_call_on/
t3_ktcsz0,100  Republicans Who Tried to Overthrow Democracy   ,https://www.reddit.com/r/democrats/comments/ktcsz0/100_republicans_who_tried_to_overthrow_democracy/
t3_ktbd7z,CYA ,https://www.reddit.com/r/democrats/comments/ktbd7z/cya/
t3_kt8it3,Obama says John Lewis  smiling down  on Georgia after election of state s first Black senator,https://www.reddit.com/r/democrats/comments/kt8it3/obama_says_john_lewis_smiling_down_on_georgia/
t3_ktjau6,Iowa Voters   Contact   Senator Joni Ernst   Particularly if you have an opinion on how she should vote if she has a second chance to put the country ahead of Donald Trump.,https://www.reddit.com/r/democrats/comments/ktjau6/iowa_voters_contact_senator_joni_ernst/
t3_ktdy46,Biden  BLM Activists Would ve Been Treated Differently at Capitol,https://www.reddit.com/r/democrats/comments/ktdy46/biden_blm_activists_wouldve_been_treated/
t3_ktj8tz,Iowa Voters   Send Grassley Questions  amp  Comments   Particularly if you have an opinion on how he should vote if he has a second chance to put the country ahead of Donald Trump.,https://www.reddit.com/r/democrats/comments/ktj8tz/iowa_voters_send_grassley_questions_comments/
t3_kt7ebr,Pelosi spoke to Joint Chiefs chairman about preventing  unstable  Trump from ordering nuclear strike,https://www.reddit.com/r/democrats/comments/kt7ebr/pelosi_spoke_to_joint_chiefs_chairman_about/
t3_ktc5nu,Trump Supporters harassing Lindsey Graham the monster he created turns on him,https://www.reddit.com/r/democrats/comments/ktc5nu/trump_supporters_harassing_lindsey_graham_the/
t3_ktd70b,Man photographed with foot on Pelosi s desk during U.S. Capitol riot arrested,https://www.reddit.com/r/democrats/comments/ktd70b/man_photographed_with_foot_on_pelosis_desk_during/
t3_ktc2hp,Kyle Griffin  kylegriffin1 NBC News obtained a draft of the article of impeachment against Trump  just read on  MSNBC . It s one article   ARTICLE I  INCITEMENT OF INSURRECTION. ,https://www.reddit.com/r/democrats/comments/ktc2hp/kyle_griffin_kylegriffin1_nbc_news_obtained_a/
t3_ktbdys,Showed  em ,https://www.reddit.com/r/democrats/comments/ktbdys/showed_em/
t3_ktgmt4, R  Senator  Lindsey Graham verbally attacked at Reagan National Airport in D.C. by Trump Supporters,https://www.reddit.com/r/democrats/comments/ktgmt4/r_senator_lindsey_graham_verbally_attacked_at/
t3_ktewj0, FBI warned of white supremacists in law enforcement 10 years ago. Has anything changed   From 2016  but considering the  storming  took very little thunder and lightning...,https://www.reddit.com/r/democrats/comments/ktewj0/fbi_warned_of_white_supremacists_in_law/
t3_ktb4u3,Fun Fact  More than US  1 260 000 per DAY is spent on US Capitol Police,https://www.reddit.com/r/democrats/comments/ktb4u3/fun_fact_more_than_us_1260000_per_day_is_spent_on/
t3_ktfmq6,Twitter bans Trump  citing risk of violent incitement,https://www.reddit.com/r/democrats/comments/ktfmq6/twitter_bans_trump_citing_risk_of_violent/
t3_ktdw2w,With all of his past and ongoing treasonous acts against our democracy  will Trump s portrait still be displayed within the White House  What happens in this situation ,https://www.reddit.com/r/democrats/comments/ktdw2w/with_all_of_his_past_and_ongoing_treasonous_acts/
t3_ktdvlh,Brianna Keilar Rips Tucker Carlson s Racist Inflammatory Rhetoric To Shreds,https://www.reddit.com/r/democrats/comments/ktdvlh/brianna_keilar_rips_tucker_carlsons_racist/
t3_kt9esv,Pelosi says Pentagon assured her there are safeguards to prevent Trump from launching nukes,https://www.reddit.com/r/democrats/comments/kt9esv/pelosi_says_pentagon_assured_her_there_are/
t3_ktf6ix,imagine trump going through withdrawal,https://www.reddit.com/r/democrats/comments/ktf6ix/imagine_trump_going_through_withdrawal/
t3_ktazdk,Congressional Democrats will pursue second impeachment of Trump   sources,https://www.reddit.com/r/democrats/comments/ktazdk/congressional_democrats_will_pursue_second/
t3_ktbfgp,Pelosi orders flags at half staff for Capitol officer who died,https://www.reddit.com/r/democrats/comments/ktbfgp/pelosi_orders_flags_at_halfstaff_for_capitol/
t3_kt41mw,Irony Alert  Pompeo And Mnuchin Had Discussions On Invoking 25th Amendment. Reference Rats  Sinking Ship,https://www.reddit.com/r/democrats/comments/kt41mw/irony_alert_pompeo_and_mnuchin_had_discussions_on/
t3_ktepjw,Twitter bans President Trump permanently,https://www.reddit.com/r/democrats/comments/ktepjw/twitter_bans_president_trump_permanently/
t3_kt4t3h,That a big difference...,https://www.reddit.com/r/democrats/comments/kt4t3h/that_a_big_difference/
t3_kthy3n,Endless  Shameless Lies  amp  Misinformation  Heather Gardner,https://www.reddit.com/r/democrats/comments/kthy3n/endless_shameless_lies_misinformation_heather/
t3_ktczt3,Georgia GOP proposes strict absentee voting measures following runoff,https://www.reddit.com/r/democrats/comments/ktczt3/georgia_gop_proposes_strict_absentee_voting/
t3_kt9zyh,Some police failed their duty. Some could even say that their anemic response constitutes assisting the rioting extremists who assaulted Capitol Hill. What s being done to bring justice to these rogue agents ,https://www.reddit.com/r/democrats/comments/kt9zyh/some_police_failed_their_duty_some_could_even_say/
t3_kt8tcm,VoteVets   Impeach,https://www.reddit.com/r/democrats/comments/kt8tcm/votevets_impeach/
t3_kt9nfa,Democratic congressman stayed in Capitol until 3 am cleaning rotunda after riot,https://www.reddit.com/r/democrats/comments/kt9nfa/democratic_congressman_stayed_in_capitol_until_3/
t3_kt3y1y,Column  Trump saw himself as a strongman leader. He ended up a one term president with a legacy of failure,https://www.reddit.com/r/democrats/comments/kt3y1y/column_trump_saw_himself_as_a_strongman_leader_he/
t3_ktd7xk,Rep. Jim McGovern Shows Capitol Damage After Attack   NowThis,https://www.reddit.com/r/democrats/comments/ktd7xk/rep_jim_mcgovern_shows_capitol_damage_after/
t3_ktb3ky,Do your best Trump supporter impression. Here s mine ,https://www.reddit.com/r/democrats/comments/ktb3ky/do_your_best_trumpsupporter_impression_heres_mine/
t3_kt8cuh,Clyburn  House should make Trump only president to be impeached twice,https://www.reddit.com/r/democrats/comments/kt8cuh/clyburn_house_should_make_trump_only_president_to/
t3_kt6rch,Sign NAACP s Call to Impeach Trump Immediately,https://www.reddit.com/r/democrats/comments/kt6rch/sign_naacps_call_to_impeach_trump_immediately/
t3_ktcble,PSA  Comment Spammer,https://www.reddit.com/r/democrats/comments/ktcble/psa_comment_spammer/
t3_ksukz6,People at the US Capitol riot are being identified and losing their jobs,https://www.reddit.com/r/democrats/comments/ksukz6/people_at_the_us_capitol_riot_are_being/
t3_kstgum,This gets truer and truer,https://www.reddit.com/r/democrats/comments/kstgum/this_gets_truer_and_truer/
t3_kt5xma,Trump Not Attending Inauguration,https://www.reddit.com/r/democrats/comments/kt5xma/trump_not_attending_inauguration/
t3_kt5r89,IMPEACH,https://www.reddit.com/r/democrats/comments/kt5r89/impeach/
t3_kt7nlr,We need police reform  The actions at the capitol just go to show that even more.,https://www.reddit.com/r/democrats/comments/kt7nlr/we_need_police_reform_the_actions_at_the_capitol/
t3_ktb200,Trump Helped Take Extremist Views From The Fringes Of Society To A Mob Attacking The Capitol,https://www.reddit.com/r/democrats/comments/ktb200/trump_helped_take_extremist_views_from_the/
t3_ktazxx,I know Christmas has passed but....,https://www.reddit.com/r/democrats/comments/ktazxx/i_know_christmas_has_passed_but/
t3_ktau5e,When a College Application site starts condemning the Republicans on Capitol Protest  you know something s wrong  Let us guide the youth of tomorrow to have sane beliefs so they can become the Obama and Roosevelt of the future ,https://www.reddit.com/r/democrats/comments/ktau5e/when_a_college_application_site_starts_condemning/
t3_ktg9bw,The ol  Marino Faliero. Damnatio Memoriae.  To treating T s legacy as a president ,https://www.reddit.com/r/democrats/comments/ktg9bw/the_ol_marino_faliero_damnatio_memoriae_to/
t3_kt9pmy,That sounds about right LOL,https://www.reddit.com/r/democrats/comments/kt9pmy/that_sounds_about_right_lol/
t3_kt4q4v,Coronavirus kills 4 000 as America suffers its deadliest day of the pandemic    and Trump caused this to happen. Let us not forget  ,https://www.reddit.com/r/democrats/comments/kt4q4v/coronavirus_kills_4000_as_america_suffers_its/
t3_kt5u9x,How the U.S. Capitol Police were overrun in a  monumental  security failure,https://www.reddit.com/r/democrats/comments/kt5u9x/how_the_us_capitol_police_were_overrun_in_a/
t3_kterdv,This is a genuine question  Did Trump s speech today look like a deepfake to anyone else ,https://www.reddit.com/r/democrats/comments/kterdv/this_is_a_genuine_question_did_trumps_speech/
t3_kt1i3z,If you live in one of these districts  your Representative objected to a legal  democratic election,https://www.reddit.com/r/democrats/comments/kt1i3z/if_you_live_in_one_of_these_districts_your/
t3_kt4gtc,The Nation on Twitter   This is not America   a woman said to a small group  her voice shaking.  They re shooting at us. They re supposed to shoot BLM  but they re shooting the patriots. ,https://www.reddit.com/r/democrats/comments/kt4gtc/the_nation_on_twitterthis_is_not_america_a_woman/
t3_ktc6pq,Jamiroquai seeking Justice for is stolen hat at Capitol Hill,https://www.reddit.com/r/democrats/comments/ktc6pq/jamiroquai_seeking_justice_for_is_stolen_hat_at/
t3_kswefm,The difference between Josh Hawley and George Orwell.,https://www.reddit.com/r/democrats/comments/kswefm/the_difference_between_josh_hawley_and_george/
t3_kt6an8,TERRORIST LEADER,https://www.reddit.com/r/democrats/comments/kt6an8/terrorist_leader/
t3_kt5vlg,Brianna Keilar on GOP  When you sell your soul  there s a debt to settle   CNN Video,https://www.reddit.com/r/democrats/comments/kt5vlg/brianna_keilar_on_gop_when_you_sell_your_soul/
t3_ksw9z8,Hot impeach cobbler comin in hot tm,https://www.reddit.com/r/democrats/comments/ksw9z8/hot_impeach_cobbler_comin_in_hot_tm/
t3_kt4jzv,If there is a god when Thomas bites it Biden will replace him with the youngest liberal judge possible,https://www.reddit.com/r/democrats/comments/kt4jzv/if_there_is_a_god_when_thomas_bites_it_biden_will/
t3_kt4z54,Time to get your stimulus check. DC police and FBI are looking for Terrorist that attacked our democracy on January 6 2021. Real patriotism pays. These are animals no better then the 911 attackers. Extreme fundamentalist terrorists. It s ok Republicans you can say it. Call your local FBI office.,https://www.reddit.com/r/democrats/comments/kt4z54/time_to_get_your_stimulus_check_dc_police_and_fbi/
t3_ksxfjo,Just remember that we were 10 people away from the Republicans being able to overthrow the will of the people and install a dictator.,https://www.reddit.com/r/democrats/comments/ksxfjo/just_remember_that_we_were_10_people_away_from/
t3_kt3o5q,I kind of wonder was the RIOT SOMETHING TO DISTRACT THE NEWS AND US FROM   Maybe THE BIGGER ISSUE .. cause during the same time someone was planting bombs everywhere  ,https://www.reddit.com/r/democrats/comments/kt3o5q/i_kind_of_wonder_was_the_riot_something_to/
t3_ksqvi0,Make this happen  Nancy,https://www.reddit.com/r/democrats/comments/ksqvi0/make_this_happen_nancy/
t3_kt3cg8,My husband who is a iraq refugee LOOKS to me as we watch the US CAPITAL STORMED AND SAYS ..THIS IS SOMETHING THAT HAPPENS IN MY COUNTRY  this is one reason I ran from there .BUT IN AMERICA NEVER Honestly it took us all day watching for him to believe it was actually happening HERE IN THE US ,https://www.reddit.com/r/democrats/comments/kt3cg8/my_husband_who_is_a_iraq_refugee_looks_to_me_as/
t3_ksx8wp,Trumpsters,https://www.reddit.com/r/democrats/comments/ksx8wp/trumpsters/
t3_kt8fxv, I Hurt For Our Country   Michelle Obama Draws Attention to Racial Disparities After U.S. Capitol Riot,https://www.reddit.com/r/democrats/comments/kt8fxv/i_hurt_for_our_country_michelle_obama_draws/
t3_kt5eva,January 19th...  Satire OC ,https://www.reddit.com/r/democrats/comments/kt5eva/january_19th_satire_oc/
t3_kt3pgb,Frustration over police response to Capitol rioters vs. BLM protesters.,https://www.reddit.com/r/democrats/comments/kt3pgb/frustration_over_police_response_to_capitol/
t3_kszvw8,everyone s hungry,https://www.reddit.com/r/democrats/comments/kszvw8/everyones_hungry/
t3_kt5qcn,A Terrified President Throws His Riot Mob Under A Bus To Save His Neck  And Get Back On Twitter ,https://www.reddit.com/r/democrats/comments/kt5qcn/a_terrified_president_throws_his_riot_mob_under_a/
t3_kt99d2,Why is no one talking about raising the minimum wage ,https://www.reddit.com/r/democrats/comments/kt99d2/why_is_no_one_talking_about_raising_the_minimum/
t3_ksvzgf,Just call them Radical Republican Terrorists... their favorite term. Why won t they use it ,https://www.reddit.com/r/democrats/comments/ksvzgf/just_call_them_radical_republican_terrorists/
t3_kt19l2,Trump Terrorist Logic,https://www.reddit.com/r/democrats/comments/kt19l2/trump_terrorist_logic/
t3_kt457v,Viral Video of Police Waving Protesters into the Capitol  ,https://www.reddit.com/r/democrats/comments/kt457v/viral_video_of_police_waving_protesters_into_the/
t3_kspej5,A Message From Captain America,https://www.reddit.com/r/democrats/comments/kspej5/a_message_from_captain_america/
t3_kswzi0,Bowser reiterates call for DC statehood after Capitol riots,https://www.reddit.com/r/democrats/comments/kswzi0/bowser_reiterates_call_for_dc_statehood_after/
t3_kt59fp,2021 keeps on delivering. Who is watching Trump right now ,https://www.reddit.com/r/democrats/comments/kt59fp/2021_keeps_on_delivering_who_is_watching_trump/
t3_kt9ylm,America  I love you  but you re freaking me out.,https://www.reddit.com/r/democrats/comments/kt9ylm/america_i_love_you_but_youre_freaking_me_out/
t3_kt3p4x,Trump publicly acknowledges he won t serve a second term a day after inciting mob,https://www.reddit.com/r/democrats/comments/kt3p4x/trump_publicly_acknowledges_he_wont_serve_a/
t3_kt2ib6,Capitol Police officer dies from injuries after clashing with pro Trump mob,https://www.reddit.com/r/democrats/comments/kt2ib6/capitol_police_officer_dies_from_injuries_after/
